link,job,company,salary,area,experience,education,companyType,companySize,direction,address,describe
https://jobs.51job.com/maoming/88690865.html?s=01&t=0,电子商务,广东世纪辉腾环保科技有限公司,0.3-1万/月,茂名,2年经验,本科,民营公司,50-150人,环保,茂名市,"['\r\n        ', '1、负责公司项目的承接及设备的销售；', '2、积极收集客户信息与市场信息，及时把握机会挖掘潜在客户；', '3、定期进行客户拜访、业务沟通、了解客户的新需求，策划合作方式；', '4、完成与大客户的业务谈判与合同签订任务；', '5、与客户进行良好的沟通，保证及时反馈客户与市场信息，加强产品在市场上的影响力；', '6、记录、汇总大客户对公司产品和服务的所有评价和要求等信息，并加以整理分析，形成报告向上级汇报；', '7、为客户提供符合公司要求的专业服务，保证当期销售业绩目标的实现及稳定提高。', '任职要求：', '工作地点：广州南沙、茂名市区', '1、化工、环保相关专业本科毕业，或有化工、环保行业销售经验；', '2、一年以上市场开拓及销售经验(环保行业优先)；', '3、具有团队合作精神和灵活的应变能力，有责任感，认真勤奋，有较强的学习能力；', '4、熟悉产品及营销技巧、负责发掘及开拓客户资源。', '5、熟悉环保行业的操作模式，有充分的人脉资源优先；', '\r\n                ', '\r\n                                        ', '职能类别：', '电子商务专员', '\r\n                                        ', '关键字：', '电子商务', '阿里巴巴', '推广', '运营', '淘宝', '\r\n                    ', '\r\n        ', '微信分享', '\r\n        ', '\r\n        ', '\r\n    ']"
https://jobs.51job.com/guangzhou-thq/111699172.html?s=01&t=0,电子商务专员（氛围好+高薪）,广州欣雅网络科技有限公司,3-4.5千/月,广州-天河区,无工作经验,中专,民营公司,少于50人,快速消费品(食品、饮料、化妆品),燕岭路银龙国际商务中心3楼3023,"['\r\n        ', '给自己找一份你热爱的工作，因为你人生的大部分时间与工作有关。在这里，我们给你的是一份你热爱的工作，让你释放激情的平台，这里是让人生成为一种享受的地方。', '\xa0', '任职要求：', '1、男女不限，17―24岁乐观积极、敢于挑战高薪。', '2、电子商务，市场营销专业优先', '3、熟悉互联网，熟悉QQ、论坛，网购等操作', '4、性格外向，沟通表达能力', '5、抗压能力及说服能力强。', '\xa0', '工作内容：简单清晰明确，在线聊天，引导客户去我们的商城拍付产品，电话预约及回访即可开展工作。', '\xa0', '工作氛围：积极向上，团结和睦，互相帮助，轻松愉快，欢乐不断', '\xa0', '待遇：', '1、底薪+高提成+奖金，员工平均工资在5000以上，进公司前三个月人均4000人民币 3个月后一般在4000-8000之间，一年后10000以上月薪。只要你肯努力薪资只会让你更加满意。', '2、奖金：设立高额提成及团队奖金制度 ，周冠军奖励，月冠军奖励，团队奖励等。更有丰厚的年终奖。', '3、晋升阶段：员工--组长--主管--股东/股份制老板', '4、每月15号准时结算工资，每月不定时有娱乐活动或者外出旅游。', '5、新人入职带薪岗前培训业务知识、并有业务组长一对一指导，公司提供完整个人职业规划，公司提供很大的晋升空间。', '\xa0', '重要福利：', '1、业绩达标可成为公司股东', '2、业绩达标，有管理能力的可以拓展新部门做老板。', '你还在为找不到属于自己的事业纠结么？还在人生的旅途中迷茫么？还在抱怨有志得不到施展么？想要属于你自己的事业么？想要改变自己的人生么？那就加入我们点燃你的激情让我们共同铸就我们心中的梦想！', '\xa0', '联系人：暖心的邓姐姐', '联系电话：18520620589，微信同步（主动就会有故事哟）', '地址：广州市天河区燕岭路银龙大厦3023（天河客运站地铁站B出口往右走直到）', '上班时间：早上8:30~12:00，下午13:30~6:00，逢周日、国家节假日放假（不加班，法定节假日完全依照国家规定放假）', '\r\n                ', '\r\n                                        ', '职能类别：', '网络/在线销售', '销售助理', '\r\n                                        ', '关键字：', '销售代表', '销售专员', '销售顾问', '销售助理', '实习生', '网络销售', '电商专员', '网络销售', '电商销售', '电商实习生', '\r\n                    ', '\r\n        ', '微信分享', '\r\n        ', '\r\n        ', '\r\n    ']"
https://jobs.51job.com/guangzhou-pyq/104337892.html?s=01&t=0,外贸电子商务运营,广州壹传诚信息科技有限公司,4-6千/月,广州-番禺区,1年经验,大专,民营公司,少于50人,计算机软件,桥南街陈涌村市南路盛汇大厦A座301,"['\r\n        ', '1.  负责公司电子商务平台店铺的日常管理、营销、推广，达成运营销售指标等；', '\xa0\xa02.\xa0协调美工设计和客服，共同努力，完成销售运营指标；', '\xa0\xa03.\xa0统计分析网站流量、产品排名、投放广告，不断调整达到最优化；', '\xa0\xa04.\xa0研习竞争对手，和美工队伍合作，不断改进店铺页面和产品页面、活动页面，增加页面吸引力。维持店铺页面详情维持高的转化率；', '\xa0\xa05.强化社交网站品牌营销，进一步促进品牌销售和影响力的最大化；', '任职要求：', '1）有eBay/amazon等电子商务平台1年以上的运营经验；', '\xa0\xa02）具大专学历或以上，备英语4级或以上水平，有较好的英语读写能力；', '\xa0\xa03）积极主动，思维灵活，学习能力强，有较强的组织、协调能力；', '\xa0\xa04）具有团队合作精神，在任何情况下能为整个团队的团结、精进做出乐观、积极高效的努力；', '\xa0\xa05）吃苦耐劳，细心且有耐心，做事积极、热情、主动,人际沟通能力良好；', '                        ', '工作时间：9：00-17：30，双休，法定假期，社保', '\r\n                ', '\r\n                                        ', '职能类别：', '电子商务专员', '\r\n                                        ', '关键字：', '外贸电商', '\r\n                    ', '\r\n        ', '微信分享', '\r\n        ', '\r\n        ', '\r\n    ']"
https://jobs.51job.com/guangzhou-pyq/115745645.html?s=01&t=0,电子商务运营助理+大小周休息,广州絮风服装有限公司,0.5-1万/月,广州-番禺区,无工作经验,大专,民营公司,150-500人,互联网/电子商务,广东省广州市番禺区大石街道植村工业区一路10号4栋3楼301（3号线大石地铁C口附近）,"['\r\n        ', '这是淘宝运营职务，如果优秀可接受无运营经验的，', '发展', '方向为独立负责店铺运营。', '工作内容：', '投递简历请注意看上班时间和地址！', '1、负责公司淘宝店铺的全系列工作：产品选择、上下架管理、市场调查和分析、售前售后、制定销售策略、站内站外营销推广等等。', '2、熟悉淘宝平台的的政策和规定，维护和管理公司店铺安全，熟悉平台的市场开发技巧和营销战略运用。', '3、及时掌握平台以及竞争对手信息，进行分析汇总，根据市场需求调整平台运营情况，满足平台发展需求。', '4、完善店铺各种政策以及制度，操持和维护好公司店铺的好评率以及信誉度，根据销售明细，进行销售分析。', '备注：原则上公司新店长都会安排负责新店铺，从新店做起，从小店做起。', '岗位要求：', '1、大专或以上学历，专业不限', '2、工作经验不限，但对互联网电商发展有浓厚兴趣，有淘宝从业经验者优先。', '3、良好的沟通能力和学习能力，勇于挑战，具有良好的团队合作精神。', '工作时间：9:00-12:00  14:00-18:00  18:45-20:30  大小周', '休息', '地址：', '广州市番禺区大石街道植村工业区一路10号4栋3楼301（大石地铁C出口附近）', ' ', '我们提供：', '1、', '薪资结构：底薪+提成+各类奖金（综合薪资', '50', '00', '-20000', '元/月）；', '2', '、专业的培训，年轻化的团队，轻松舒适的办公氛围；', '3', '、全方位成长机会及职业晋升通道。', '4、', '不定期团建聚餐福利，', '生日会', '零食水果、你的体重我们负责增加', '5、', '办公环境优美，交通方便（靠近地铁站），设备齐全，公司设有冰箱，微波炉等', '6、', '更多福利待遇将随公司发展逐步完善', ' ', '\r\n                ', '\r\n                                        ', '职能类别：', '网站运营专员', '网店/淘宝运营', '\r\n                                        ', '关键字：', '电子商务运营', '\r\n                    ', '\r\n        ', '微信分享', '\r\n        ', '\r\n        ', '\r\n    ']"
https://jobs.51job.com/guangzhou-thq/113833652.html?s=01&t=0,电子商务主管,创意工房餐饮,0.8-1万/月,广州-天河区,3-4年经验,大专,民营公司,50-150人,餐饮业,猎德兴盛路15号博雅御轩,"['\r\n        ', '岗位职责：', '  ', '1、负责公司品牌属下的小程序、商城优化及社群推广，会利用自媒体各大平台软件推广，日常维护与更新；', '  ', '2、会利用互联网，社交软件等新媒体工具开拓新市场，实现多渠道推广，发展新客户。', '  ', '3、负责小程序、商城的推广及玩法，制定活动策略和执行，挖掘社群营销+小程序新渠道。', '  ', '4、负责小程序、商城日常运营工作，内容编辑，日常维护，整理分析运营数据及传播效果，优化运营方案。', '  ', '5、研究新媒体新玩法，关注时下传播热点，并与社群和小程序结合更好的输出内容。', '  ', ' ', '  ', '岗位要求', '  ', '1、 有过小程序运营经验，对支付宝、微信小程序生态有深入了解优先；', '  ', '2、 性别、专业不限，电子商务、市场营销类优先；', '  ', '3、 小程序运营经验1-2年；', '  ', '4、 有蛋糕、鲜花行业经验优先；', '  ', '5、 90后优先；', '  ', '6、 聪明、皮实、思维活跃、高效协同;', '  ', '7、 有运营与活动策划能力者优先；', '  ', '8、 有一定文字语言功底、内容运营能力者优先', '  ', '\r\n                ', '\r\n                                        ', '职能类别：', '电子商务经理/主管', '电子商务专员', '\r\n                                        ', '关键字：', '电子商务', '电商主管', '互联网推广', '网站运营', '市场营销', '\r\n                    ', '\r\n        ', '微信分享', '\r\n        ', '\r\n        ', '\r\n    ']"
https://jobs.51job.com/guangzhou-hzq/115967046.html?s=01&t=0,电子商务运营助理,广州川上文化传媒有限公司,3-4.5千/月,广州-海珠区,无工作经验,大专,民营公司,50-150人,影视/媒体/艺术/文化传播,海珠区燕子岗南路83号广印创意园,"['\r\n        ', '1.协助领导做好各种表格数据统计；', '2.日常行政财务事项协助处理；', '3.店铺的日常操作与维护；', '任职要求：', '1.有电商基础经验，踏实、耐心、细心。', '2.有团队意识，服从领导安排的各项工作。', '3.积极上进，具备一定的抗压能力，责任心强。', '\r\n                ', '\r\n                                        ', '职能类别：', '网店/淘宝运营', '电子商务专员', '\r\n                                        ', '关键字：', '电商运营', '运营助理', '数据统计', '\r\n                    ', '\r\n        ', '微信分享', '\r\n        ', '\r\n        ', '\r\n    ']"
https://jobs.51job.com/guangzhou-lwq/95755401.html?s=01&t=0,急招电子商务多资源,绿瘦健康产业集团有限公司,0.8-1万/月,广州-荔湾区,无工作经验,招8人,民营公司,1000-5000人,美容/保健,花地大道南绿瘦健康产业园,"['\r\n        ', '公司描述：', '绿瘦健康产业集团是一家以大数据为核心，集体重管理产品研发、生产、销售、服务于一体，致力成为专业体重管理服务企业。', '绿瘦深耕专业十余年，积极探索科学、合理的体重管理系统，积极开拓科学有效的体重管理模式，采用“营养+运动+服务”的科学体重管理方法，形成了包含体重管理、生物科技、电子商务、绿瘦纤体、绿瘦美学馆、减肥训练营、智能健身房、好享瘦APP资讯平台等业务，目前已完成体重管理生态闭环的初步布局，由此形成了“科学管理体重”的生态蓝图。', '工作职责：', '1、根据公司提供的资源通过公司的电话平台对客户的订单进行确认，促成销售；', '岗位要求：', '1、年满18周岁，学历不限，男女不限，党员优先；', '2、会说普通话，表达与沟通能力强；', '工作时间：', '10:00-19:00', '薪酬：', '\xa0薪资结构：无责底薪+全勤+提成', '员工福利：', '1、入职即签订劳动合同，属绿瘦正式编制员工，享受绿瘦正式待遇；', '2、过节礼品、生日礼物、春节利是等多项福利；', '3、购买社会保险（享受养老、医疗、失业、工伤、生育五险）社会福利保障；', '4、享受带薪年假；', '5、为员工提供公寓式的住宿环境，试用期免费住宿；', '6、公司有员工饭堂，员工享有优惠价格；', '7、上下班期间有班车接送，有独立的图书馆，供员工及时充电；', '8、丰富多彩的员工活动：员工聚餐、节日晚会、旅游活动、趣味运动会、优秀员工表彰活动等；', '9、提供带薪岗前培训、衔接培训、管理能力培训等专业培训和广阔的职业发展空间个人的发展。', '员工晋升：', '1、公司关注员工的发展，为每个层级的员工制定了发展规划：', '专业路线：\xa0电销专员职级的晋升管理路线：\xa0电销专员-\xa0主管-经理-高级经理-总监', '此外，电销专员也可向行政管理、人员管理、培训讲师、业务支持管理、市场分析管理等多方向发展', '2、透明，公正，公开的考核制度，可以让您的职业规划的更加清晰。', '联系电话：周', '小姐13790087001', '（欢迎投递简历，合适即安排面试）', '\r\n                ', '\r\n                                        ', '职能类别：', '大客户销售', '销售代表', '\r\n                                        ', '关键字：', '电话销售', '\r\n                    ', '\r\n        ', '微信分享', '\r\n        ', '\r\n        ', '\r\n    ']"
https://jobs.51job.com/guangzhou-lwq/99052249.html?s=01&t=0,电子商务（阿里巴巴）,广州市乐天笔业有限公司,0.8-1万/月,广州-荔湾区,1年经验,高中,民营公司,50-150人,互联网/电子商务,荔湾区桥中中路159号桥康汇南塔1009室，地铁5和6号线坦尾站D出口前200米,"['\r\n        ', '本公司招聘业务员：电子商务，主要做1688批发网销售业务，也有国内的一些礼品展会，希望有销售经验的精英可以联系我面试。', '本公司产品有：高中低档广告礼品笔，促销笔。\xa0 高档可以充电，带U盘的笔记本，货值高，客人接受程度高。', '待遇：底薪5000左右，有社保，法定节假日，不加班，大小周。', '本公司已经运作了15年了，阿里巴巴国际站10年了，1688已经13年了。销售渠道有：广交会，法兰克福展，日本东京展。国内：深圳礼品展，北京礼品展会。希望有能力，想赚钱，不满足现状的90后可以联系我：18027315322\xa0 \xa013760816166袁先生。', '\r\n                ', '\r\n                                        ', '职能类别：', '电子商务专员', '网络推广专员', '\r\n                                ', '\r\n        ', '微信分享', '\r\n        ', '\r\n        ', '\r\n    ']"
https://jobs.51job.com/guangzhou-thq/119033046.html?s=01&t=0,电子商务专员,广州陛雅唛客贸易有限公司,4-8千/月,广州-天河区,2年经验,招1人,民营公司,50-150人,贸易/进出口,广州市天河区华观路田头岗二路一横街4号A座三楼,"['\r\n        ', '1、对电商运营平台客户的维护、服务、最终转化成订单；', '2、懂汽配销售，了解市场情况和顾客的需求；', '3、售前，售中，售后处理；', '4、平台数据整理；把控退货率，把控平台各项评分标准；', '任职要求：', '1、熟悉EPC或者热爱ETK等软件查询优先', '2、熟悉平台销售操作【例如开思，巴图鲁工作经验优先】', '3、良好的销售触觉，懂得与客户沟通交流，语言沟通表达能力强；', '4、人品端正，正直开朗；', '晋升机制：', '运营主管―运营总监。', '福利待遇：', '1、薪资=基本工资+全勤奖+补贴', '2、定期年度体检、团队活动、学习充电、员工旅游、交流培训等', '培训与发展', '1、公司有完善的培训体系，为员工提供更全面的汽车配件知识海洋、创建交流学习的良好氛围、专业的管理系统。', '2、为员工提供多种横向、纵向职业发展渠道。', '我们是互帮互助、团结友爱、有人教、有人带、有人帮的一种企业文化氛围。', '成熟的团队配置，丰富的管理经验，使新员工开单无压力。', '上班、面试地址：广州市天河区华观路田头岗二路一横街4号A座三楼；', '上班时间：朝九晚六（9:00-12:00,13:00-18:00），月休四天轮休制（介意勿投）', '・・・有意者请通过企业邮箱投递简历，合则约见・・・・谢谢。', '\r\n                ', '\r\n                                        ', '职能类别：', '网站运营专员', '\r\n                                        ', '关键字：', '电商运营', '汽配销售', '\r\n                    ', '\r\n        ', '微信分享', '\r\n        ', '\r\n        ', '\r\n    ']"
https://jobs.51job.com/guangzhou-thq/116817653.html?s=01&t=0,电子商务运营,广州集和堂大药房连锁有限公司,3.5-6千/月,广州-天河区,2年经验,招1人,民营公司,150-500人,医疗/护理/卫生,黄埔大道中280号第三层自编之二（乐雅苑1座3楼）,"['\r\n        ', '1、负责公司自有B2C电商平台店铺搭建、优化等整体工作，主要为版面和推广文案等方面，确保线上、线下销售良性结合；', '2、负责产品相关内部业务的牵头对接并与IT技术、采购、仓库、客服、美工等各岗位进行工作对接。', '3、制定和实施店铺不定期促销活动的推进、优化，对店铺的销售指标负责；', '4、操作自有电商平台卖家管理系统，落实店铺具体商品的上架，具体执行产品定价、上下架、发布、信息更新等工作；', '5、把控售前、售中、售后的客户服务。', '任职要求：', '1、男女不限，大专以上学历，2年以上相关工作经验；', '2、熟悉电子商务流程（网上商城、淘宝店、京东等），熟悉网上购物和销售、推广、优化、维护；', '3、熟练电子商务平台的操作规范和流程；', '4、通能力良好，有较强的协调能力、有责任心、抗压能力强。', '\r\n                ', '\r\n                                        ', '职能类别：', '市场/营销/拓展专员', '\r\n                                        ', '关键字：', '运营', '电商', '\r\n                    ', '\r\n        ', '微信分享', '\r\n        ', '\r\n        ', '\r\n    ']"
https://jobs.51job.com/guangzhou/114602475.html?s=01&t=0,电子商务经理,广州市欧韵佳服饰实业有限公司,1.5-2.5万/月,广州,无工作经验,招1人,民营公司,150-500人,服装/纺织/皮革,广州市海珠区工业大道中313号东方红创意园东6栋（整栋）,"['\r\n        ', '1、根据公司战略发展需要,制订电商平台营销的战略方式和营销策略,优化运营流程,开发业务模块,建立完善的线上运营体系;', '2、制定全年运营规划、产品营销推广方案,安排本部门各项活动规划的执行、维护及改进;', '3、指导与监控公司各大型销售网站(如天猫,京东等)的线上运营管理及分销、零售工作,承担线上运营任务,并对线上营业额和利润负责;', '4、根据不同电商渠道特点,结合行业及渠道资源,针对性设计不同渠道间的差异化销售策略,制定产品促销方案;', '5、对电商市场整体趋势、竞争对手等情况进行分析以及对网络各项运营指标进行分析和总结,制定合理的运营计划;', '6、制定电子商务数据分析模板,对客户消费行为进行充分挖掘和分析;实施系统性市场调研,定期汇总行业数据、竞争对手、同类产品的收集、整理与分析,策划实施消费者调查,为公司的总体战略决策制定提供相关市场依据;', '7、与相关网站、媒体、行业协会及相关单位建立良好的业务合作关系,发展与培养合作伙伴;', '8、与线下相关资源做好线上品牌推广建设,提高品牌与产品知名度与美誉度。', '任职资格:', '1、大学专科以上学历;电子商务、市场营销等相关专业;', '2、精通B2C、C2C类电子商务网站及平台型企业的盈利模式和运营管理模式;', '3、有良好的电商平台合作资源,以及成功的项目合作案例;', '4、具有电商团队运营管理经验和多平台操作管理经验。', '\r\n                ', '\r\n                                        ', '职能类别：', '网站运营经理/主管', '网店/淘宝运营', '\r\n                                        ', '关键字：', '电商经理', '运营', '\r\n                    ', '\r\n        ', '微信分享', '\r\n        ', '\r\n        ', '\r\n    ']"
https://jobs.51job.com/guangzhou-thq/114664321.html?s=01&t=0,网络推广/电子商务专员+包吃住,广州天雄网络科技有限公司,0.8-1万/月,广州-天河区,无工作经验,中技,民营公司,1000-5000人,网络游戏,天河区中山大道中珠村东英国际机械城东英办公楼422,"['\r\n        ', '工作内容：', '1. 按照公司流程，通过各种平台推广公司指定的游戏产品', '2. 在游戏内维护好玩家，保持玩家活跃度和稳定性，减少玩家的流失率等。', '3、根据公司游戏开服时间维护玩家进驻游戏，避免流失。', '4、负责在游戏内带动玩家气氛，保持活跃度和稳定性，指导新手玩家进行游戏体验。', '职位要求：', '1、年龄18-28岁，男女不限；', '2、真心喜欢游戏，有激情，并有志于从事游戏行业；', '3、曾担任过游戏公会（帮会）或者创建过游戏公会（帮会）者优先考虑；', '4、熟练使用YY、QQ等网络聊天工具，具有一定的文字以及语言的沟通能力；', '5、 性格开朗（起码网络上要开朗互动性强），热爱与人交流，主观能动性强，团队意识强。', '薪资：2700-3500+5%-19%提成（月收入6千左右）', '工作时间：', '每天8小时工作制，法定节假日照常放假。', '月休4天，可自行调休（上班时间9:30-20:00）公司包食宿。', '晋升环节：', '包含（专员―主管―经理―总监―分公司总经理）', '工作环境：', '装修全新的两层楼几千平方米办公场所，充满游戏气息的大屏显示，每日中午好吃的员工餐(随时可能看到小龙虾的身影出现）', '您所在的团队是一个满是热血、工作强劲、敢打敢拼的青年团队，公司具有舒适的员工休闲区大阳台、娱乐区、有舒适的住宿环境。', '公司网站：http://www.tianqihuyu.com', '\r\n                ', '\r\n                                        ', '职能类别：', '网络推广专员', '电子商务专员', '\r\n                                        ', '关键字：', '推广', '游戏', '手游', '网络', '销售', '客服', '包住', '包吃', '助理', '文员', '\r\n                    ', '\r\n        ', '微信分享', '\r\n        ', '\r\n        ', '\r\n    ']"
