link,job,company,salary,area,experience,education,companyType,companySize,direction,address,describe
https://jobs.51job.com/guangzhou-lwq/119645806.html?s=01&t=0,会计（广州或者佛山办公）双向选择,广州灵飞电子商务有限公司,3.5-5千/月,广州-荔湾区,2年经验,大专,民营公司,50-150人,贸易/进出口,中山八路新虹街48号荔景楼B座501室,"['\r\n        ', '1.熟悉会计内外账目的处理，能够独立开展公司全盘内帐的会计账务工作；', '2.负责各类明细分账的核算及月末结账；', '3. 核算应收, 应付账款，与供应商对账；', '4.采购数据、日常报销费用的审核，并登记入账。监管仓库数据、 编制、核算每月的工资表；', '任职要求：', '1.会计、财务或相关专业毕业，持有会计相关专业资格证；', '2.熟悉使用ERP、金蝶等相关财务软件，办公室软件能够进行熟练的操作与应用；', '3.积极主动、细心、责任心强，工作灵巧、效率高；', '4.良好的沟通技巧,分析能力以及解决问题的能力；', '5.优秀应届毕业生也可。', '\r\n                ', '\r\n                                        ', '职能类别：', '会计', '财务主管/总账主管', '\r\n                                        ', '关键字：', '会计', '财务', '外贸财务', '内账', '财务助理', '会计主管', '\r\n                    ', '\r\n        ', '微信分享', '\r\n        ', '\r\n        ', '\r\n    ']"
https://jobs.51job.com/guangzhou-thq/119645709.html?s=01&t=0,电商美工,广州海货电子商务有限公司,5-8千/月,广州-天河区,2年经验,大专,民营公司,150-500人,互联网/电子商务,广州市天河区大灵山路61号科创营G栋409房,"['\r\n        ', '岗位职责：', '1、负责社群海报设计及制作；', '2、负责朋友圈素材设计及制作；', '3、负责社交媒体平台传播素材设计及制作；', '4、负责促销专题页面、详情页的设计', '5、完成上级交办的其它工作任务，定期向上级报告工作。', '任职要求：', '1、具备审美品位，有较强的设计能力，美术、广告、平面设计等专业优先;', '2.、一年以上互联网设计相关的工作经验，能胜任以上工作内容；', '3、具备好的沟通能力和团队精神,能够在规定的时间内独立完成各类工作;', '4、懂摄影会视频制作者优先;', '5、请将简历附带自己满意的相关作品。', '\r\n                ', '\r\n                                        ', '职能类别：', '网店美工', '平面设计师', '\r\n                                        ', '关键字：', '美工', '淘宝美工', '平面设计', '网店美工', '设计', '天猫美工', '电商美工', '\r\n                    ', '\r\n        ', '微信分享', '\r\n        ', '\r\n        ', '\r\n    ']"
https://jobs.51job.com/guangzhou-thq/119644643.html?s=01&t=0,电工,广州千鲜电子商务有限公司,4.5-6千/月,广州-天河区,2年经验,中专,民营公司,1000-5000人,批发/零售,广州市天河区广汕二路600号柯木�i软件园2栋2楼2千鲜汇,"['\r\n        ', '1、负责项目水/电、设备安装工程的进度、质量、安全文明的现场管理工作；\xa0', '2、负责涉及水/电、设备安装的设计变更的现场管理；\xa0', '3、配合做好现场施工资料（施工、检测、验收及隐蔽工程）；', '4、技术、安全交底，配合做好现场文明施工和安全管理工作；\xa0', '入职要求：', '1.大专及以上文化水平并持相应岗位证书。', '2.熟悉室内安装工程及地下综合管网的安装，并熟悉水平仪、全站仪的测量使用。', '3.具有团队合作精神及耐劳精神。', '补充说明：', '上班时间：12:00-22:00', '上班地址：广东省内可就近安排', '\r\n                ', '\r\n                                        ', '职能类别：', '电工', '电力线路工', '\r\n                                        ', '关键字：', '电工', '维修电工', '水电工', '\r\n                    ', '\r\n        ', '微信分享', '\r\n        ', '\r\n        ', '\r\n    ']"
https://jobs.51job.com/guangzhou-pyq/119643636.html?s=01&t=0,后勤专员,宝多多电子商务（广东）有限公司,4-6千/月,广州-番禺区,1年经验,大专,民营公司,500-1000人,互联网/电子商务,保利大都汇A3栋2403,"['\r\n        ', '工作职责及工作内容描述：', '1.负责公司商务接待的执行安排；', '2.负责公司大型培训、会议、活动的行政后勤安排，包括场地安排、车辆安排、用餐安排、住宿安排等；', '3.处理接待、活动现场中的所有行政后勤问题；', '4.负责公司固定资产的管理、办公用品采购及管理工作；', '4.', '协助上级进行日常行政后勤相关问题。', '任职要求：', '1.', ' 大专以上，', '身高178cm以上，***优先，', '形象端正，有一定的商务接待礼仪知识；', '2.有C1驾驶执照，并有两年以上驾驶经验', '3.熟悉行政工作流程，办公用品采购流程，企业资产管理；', '4.熟练使用办公室软件和办公自动化设备；', '5.沟通能力强，逻辑思维好。', '\r\n                ', '\r\n                                        ', '职能类别：', '后勤', '\r\n                                        ', '关键字：', '行政后勤', '接待', '\r\n                    ', '\r\n        ', '微信分享', '\r\n        ', '\r\n        ', '\r\n    ']"
https://jobs.51job.com/guangzhou-thq/119464481.html?s=01&t=0,拼多多运营/店长,上海去美电子商务有限公司,0.6-1万/月,广州-天河区,1年经验,招1人,民营公司,50-150人,互联网/电子商务,冼村中路11号珠江新城保利威座北塔36楼,"['\r\n        ', '1、负责公司拼多多平台及京东的整体规划、营销、推广等；', '2、制定店铺的销售计划，完成公司下达的销售任务、经营目标；', '3、负责平台店铺日常维护、产品更新、页面优化和各项数据监控追踪，及时做出改进措施，提高店铺点击率和成交量等；', '4、定期策划店铺活动，提升品牌影响力及店铺流量；', '4、具备将强的创新与市场分析、营销、推广能力；', '5、分析汇报业绩影响原因并拟定解决方案；', '6、与平台保持良好沟通。', '岗位要求：', '1、大专及以上学历（条件优秀者可放宽学历要求）；', '2、熟悉美妆个护行业，对拼多多有一定的了解；', '3、有1年以上美妆个护行业经验优先考虑；', '4、思维活跃、创新意识强；熟练使用office办公软件，对数据敏感，擅于收集、归纳及分析各种营销数据；', '5、具备较强的沟通能力和应变能力。', '\r\n                ', '\r\n                                        ', '职能类别：', '电子商务专员', '网店/淘宝运营', '\r\n                                        ', '关键字：', '拼多多', '网站运营', '店长', '\r\n                    ', '\r\n        ', '微信分享', '\r\n        ', '\r\n        ', '\r\n    ']"
https://jobs.51job.com/guangzhou-thq/119443226.html?s=01&t=0,总经理助理,广州乐荟电子商务有限公司,0.7-1.2万/月,广州-天河区,无工作经验,招1人,民营公司,少于50人,批发/零售,广州市天河区体育西路191号中石化大厦B塔2912-13室,"['\r\n        ', '岗位职责：', '1、协调总经理的日程安排，客户拓展和维护公司客户，做好预约工作、安排商务活动；', '2、协助总经理，参与公司相关商务活动处理公司的公关事务，负责接待客户、客人及公司对外的联谊联络工作；', '3、跟进商务合作中后续合同流程进展情况，及档案资料的管理。', '4、协助总经理处理日常事务与各职能部门的联络、协调，做好上情下达工作；', '5、协助总经理进行企业文化、战略发的规划，配合开展企业文化工作；', '6、完成总经理安排的其他工作。', '任职资格', '1、', '大学本科以上学历；', '2', '、', '具有良好的社交礼仪和公关能力，形象好、气质佳；', '3、具备较强的文字撰写能力和较强的沟通协调以及语言表达能力，熟练使用word、Excel等软件；擅长做PPT；', '4、', '有严密的逻辑思维能力和全面的分析判断能力，较强的统筹协调能力，', '5、', '可以接受短期外出商务随行的工作；', '\r\n                ', '\r\n                                        ', '职能类别：', '总裁助理/总经理助理', '\r\n                                        ', '关键字：', '助理', '秘书', '总经理助理', '\r\n                    ', '\r\n        ', '微信分享', '\r\n        ', '\r\n        ', '\r\n    ']"
https://jobs.51job.com/guangzhou-hpq/118885049.html?s=01&t=0,新媒体运营专员,广东海通电子商务科技有限公司,6-8千/月,广州-黄埔区,2年经验,招1人,民营公司,少于50人,计算机软件,萝岗奥园广场H6栋2101室,"['\r\n        ', '职责：', '1. 负责新媒体渠道的达人推广工作；', '2. 负责构建和评估新媒体渠道发展方向，运营推广计划方案制定并落地执行；', '3. 负责各个新媒体渠道的内容发布、图文装饰、客户关系维护、营销设置、店铺短中期发展规划；', '4. 熟悉网络流行语言，并根据时下热门话题&流行元素进行有效传播，提高运营渠道品牌知名度；', '5. 负责新媒体平台的活动报名、平台运营对接、年月日数据报表&全年活动计划节点布置安排；', '6.独立的新媒体活动策划，执行，评估，数据分析能力，具有一定的文案功底，具有话题性设计和互动能。', '岗位要求：', '1.两年相关工作经验，大专以上学历，电子商务、传媒、广告相关专业优先；', '2.精通抖音、小红书、快手、公众号、头条等的玩法和基础技巧，或者能迅速成为圈内高手;', '3.有各种脑洞大开的创意，为人幽默风趣，思维活跃，善于捕捉热点事件与话题，对网络语言敏感度高;', '4.有短视频运营、策划经验，熟知短视频运营以及视频制作过程相关经验，并具备基本的视频剪辑技巧.', '【工作时间】：', '周一至周五 9:00-12:00,13:30-18:00，双休，享受国家法定节假日；', '\r\n                ', '\r\n                                        ', '职能类别：', '媒介专员', '\r\n                                ', '\r\n        ', '微信分享', '\r\n        ', '\r\n        ', '\r\n    ']"
https://jobs.51job.com/guangzhou-hzq/118864522.html?s=01&t=0,薪酬绩效专员,广州市魔范电子商务有限公司,4.5-6.5千/月,广州-海珠区,2年经验,本科,民营公司,150-500人,互联网/电子商务,广州市工业大道南海珠创意产业园,"['\r\n        ', '岗位职责：', '1.  根据公司薪酬管理制度，协助及组织公司或部门定期开展绩效评估工作，对绩效指标完成状况进行汇总与分析，并根据各岗位的考核结果及各部门各岗位绩效考核指标的合理性适时建议调整。', '2.  协助上司定期组织召开公司或部门绩效分析会，形成绩效改进措施与方案，并跟进落实。', '6、 建立及修订KPI指标库，对各部门绩效指标订立合理性进行有效辅导，及时回应其他部门对绩效实施意见与建议；""', '3.  负责员工的薪资核算，确保薪资发放的准确性和及时性。', '4.  公司人力成本的预算、统计及分析；', '5.  通过各种渠道了解当地同类型企业的薪酬福利水平和员工对薪酬福利的满意度，为企业制定薪酬福利政策和标准提供依据；""', '6.  各类异动手续的沟通及办理；', '7.  负责劳动合同与劳动关系管理，处理劳动纠纷，及员工的咨询或申诉等；""', '8.  协助上司制定公司所有薪酬激励制度及方案，并实施；', '岗位要求：', '1、  本科及以上学历，人力资源等相关专业，有2年以上薪酬绩效等相关岗位经验，熟悉劳动合同法，劳动法，社保，税务等，有薪酬激励方案撰写和推行经验优先考虑。', '                                                    ', '2、', '   ', '具有较强的沟通能力及团队协作能力，积极主动。', '\r\n                ', '\r\n                                        ', '职能类别：', '薪资福利专员/助理', '绩效考核专员/助理', '\r\n                                        ', '关键字：', '薪酬核算', '社保公积金', '绩效考核', '\r\n                    ', '\r\n        ', '微信分享', '\r\n        ', '\r\n        ', '\r\n    ']"
https://jobs.51job.com/guangzhou-thq/111907688.html?s=01&t=0,招聘经理,广州国联水产电子商务有限公司,0.8-1.2万/月,广州-天河区,5-7年经验,本科,上市公司,1000-5000人,互联网/电子商务,广州大道中988号圣丰广场32楼,"['\r\n        ', '岗位描述：', '1、根据业务规划制定招聘规划，并能有效实施招聘计划，及时满足业务方需求；', '2、懂业务，对业务的用人需求挖掘出对应的胜任力关键要素，并能够很好地交付招聘结果；', '3、管理并推进招聘渠道优化，良好地管理猎头、招聘网站、招聘服务供应商等渠道，并不断使用新的理念和平台来探索新的招聘方法，提升效能；', '4、整体招聘预算把控及管理，运营并完善人才库；', '5、招聘流程及平台的优化与改进，以确保整体招聘效能提升；', '6、定期对招聘数据进行分析并采取有效方式提高招聘效率 。', '岗位要求：', '1、统招本科及以上学历，至少3-5年专注招聘的经验，尤其是具备丰富快消品行业的海招聘的工作经验；', '2、优秀谈判及沟通能力，可有效拓展维护招聘渠道；', '3、熟练掌握人力资源规划与配置方法，职位分析、人才测评、招聘面试等方面的专业知识和技巧；', '4、具备较强的抗压能力、有激情、推动力强，能不断挑战自己，突破创新；', '5、非常熟悉快消品行业职位的特点，有快消品行业从业背景的优先；', '\r\n                ', '\r\n                                        ', '职能类别：', '招聘经理/主管', '人事经理', '\r\n                                        ', '关键字：', '招聘', '招聘经理', '招聘主管', '人力资源主管', '人力资源经理', '\r\n                    ', '\r\n        ', '微信分享', '\r\n        ', '\r\n        ', '\r\n    ']"
https://jobs.51job.com/guangzhou/94422536.html?s=01&t=0,运油司机（上市公司）,中经汇通电子商务有限公司,4.5-6千/月,广州,无工作经验,招1人,民营公司,500-1000人,互联网/电子商务,广州市白云区新白云国际机场,"['\r\n        ', '岗位职责：', '1、为广州新白云国际机场运输石油成品；', '2、全天待命，以备公司调派；', '3、完成上级交代的其他任务。', '任职要求：', '1、拥有A1或A2驾驶执照，有运输工作经验者优先；', '2、无不良嗜好；', '3、应聘人员及其父母和配偶均无犯罪记录；', '4、入职前，在公司的指引下，需考取机场驾驶证。', '薪酬待遇：', '1、入职即可享受五险一金，薪酬面议；', '2、正式员工享有各项节日福利及津贴。', '工作地址：广州新白云国际机场。', '面试地址：广州市天河区龙口中路203号华天国际广场三楼。', '\r\n                ', '\r\n                                        ', '职能类别：', '货运司机', '\r\n                                        ', '关键字：', '上市公司', '五险一金', 'A1', 'A2', '驾驶证', '\r\n                    ', '\r\n        ', '微信分享', '\r\n        ', '\r\n        ', '\r\n    ']"
https://jobs.51job.com/guangzhou-yxq/72428133.html?s=01&t=0,电商客服,以纯集团电子商务总部,3.3-5千/月,广州-越秀区,无工作经验,大专,民营公司,10000人以上,互联网/电子商务,广州市越秀区东风东路761号丽丰中心24层全层,"['\r\n        ', '岗位职责：', '1、熟练使用咚咚/旺旺在线聊天工具，做好日常客服等相关服务接待；', '2、处理后台订单审核及纠纷单；', '3、对日常的工作问题做好记录，并将问题进行分类处理；', '4、处理退货退款及换货登记；', '5、其他需要处理的客服日常工作；', '6、熟练运用office及良好的文档写作能力。', '岗位要求:', '1、1-2年京东/天猫平台客服经验，工作努力认真者亦可考虑；', '2、有团队精神，工作细心。', '上班时间：', '早班：8:30-17:30\xa0\xa0晚班\xa015:00-0:00（晚班有补贴）', '薪资：', '基本工资+丰厚提成', '\r\n                ', '\r\n                                        ', '职能类别：', '网店/淘宝客服', '网络/在线客服', '\r\n                                        ', '关键字：', '客服', '淘宝', '天猫', '售前', '京东', '电子商务', '售后', '投诉', '咨询', '网店', '\r\n                    ', '\r\n        ', '微信分享', '\r\n        ', '\r\n        ', '\r\n    ']"
https://jobs.51job.com/guangzhou-hzq/119631632.html?s=01&t=0,小红书运营,广州集优电子商务有限公司,0.5-1.2万/月,广州-海珠区,1年经验,大专,民营公司,150-500人,互联网/电子商务,广州市海珠区福场路5号富力金禧商务中心712,"['\r\n        ', '岗位职责：', '1、负责品牌在小红书上的运营与推广；', '2、联系KOL及协助审稿改稿；', '3、能根据品牌的市场需求，制定品牌推广计划，独立完成工作。', '岗位要求：', '1、大专及以上学历；', '2、1年以上运营经验，有小红书运营经验优先；', '3、熟练使用办公软件，会做PPT报告；', '4、有一定的文案和审美功底；', '5、小红书用户，会玩各种社交软件，微博、抖音等；', '6、美妆爱好者，对化妆有很浓烈的兴趣，时尚感强。', '参考乘车方式：', '1.\xa0地铁站：地铁二号线市二宫站D出口，沿同福东路直走890米，右转走80米即到；', '2.\xa0公交站：市红会医院站、堑口站、宝岗大道北站、海幢公园站、市红会医院北门总站。', '\r\n                ', '\r\n                                        ', '职能类别：', '新媒体运营', '网站运营专员', '\r\n                                        ', '关键字：', '小红书', '新媒体运营', '电商运营', '平台', '渠道运营', '运营', '电子商务专员', '\r\n                    ', '\r\n        ', '微信分享', '\r\n        ', '\r\n        ', '\r\n    ']"
https://jobs.51job.com/guangzhou-thq/119617771.html?s=01&t=0,急聘安保200/天包吃住,广州狐魅电子商务有限公司,4.5-6千/月,广州-天河区,无工作经验,初中及以下,民营公司,150-500人,电子技术/半导体/集成电路,可就近安排,"['\r\n        ', '工作内容：', '职位要求：', '工作时间：工作内容：', '职位要求：', '工作时间：工作内容：', '职位要求：', '工作时间：150-220/天酱油安保', '大量招聘商场/物业/小区保安员', '【招聘要求】', '1、18-45岁 168cm或以上，五官端正，身体健康，无纹身、无染发、无犯罪记录；', '工作岗位', '商场巡查 监控室 停车场 ', '工作地址', '白云嘉禾望岗，天河珠江新城，体育西路，猎德', '工资平时待遇170/天 ', '过年期间三天220/天', '包住不包吃 要求最少做到2月10号', '应聘地址：天河区统一办入职', '应聘时间', '周一至周五', '上午9:30--11:30', '下午14:00--16:30', '\r\n                ', '\r\n                                        ', '职能类别：', '保安人员', '\r\n                                        ', '关键字：', '保安', '安保', '\r\n                    ', '\r\n        ', '微信分享', '\r\n        ', '\r\n        ', '\r\n    ']"
https://jobs.51job.com/guangzhou-hzq/118538489.html?s=01&t=0,运营经理（天猫）,北京佳百利电子商务有限公司,1.5-2.5万/月,广州-海珠区,5-7年经验,大专,民营公司,50-150人,互联网/电子商务,新港中路397号TIT创意园,"['\r\n        ', '1、根据公司整体发展战略，制定完整的天猫店铺发展策略，形成有效的销售计划。通过制定合理预算，及资源协调等手段达成销售目标；', '2、负责店铺页面板块策划，线上活动和专题的策划，线上推广创意及效果优化；持续提升点击率、转化率、DSR等各项综合指标；', '3、负责产品资料的收集、卖点提炼、需求制作，和设计师配合完成产品详情页并不断优化。制定产品运营计划，确保点击率、转化率、搜索排名等对销售重要的指标不断提升；', '4、合理运用付费预算，控制花费并评估产出效果，持续优化投入产出比；', '5、负责研究基于天猫等平台站内外各种推广渠道和方法。', '6、管理运营团队，制定部门规范流程，提高运营效率，做好跨部门沟通工作，完成公司销售目标。', '任职资格：', '1、五年及以上天猫运营推广工作经验，两年以上运营管理经验，熟悉各种线上活动的推广手段,对各种网络推广方式较为了解,并具备实际操作经验,对在网上推广富有灵感和创意;', '2、有年销售额过亿店铺运营及管理工作经验优先，化妆品类目优先；', '3、熟练掌握常用Office办公软件Excel\xa0、Word、PPT，思维导图等；', '4、积极主动，责任心强，团队合作精神，很强的沟通能力和创新能力。', '5、具备较强的事业心和激情，工作积极主动，认真负责，用心勤奋，抗压能力强。', '6、有化妆品、香水、进口产品等类目天猫店铺运营经验的优先考虑。', '\r\n                ', '\r\n                                        ', '职能类别：', '电子商务经理/主管', '电子商务总监', '\r\n                                        ', '关键字：', '天猫运营', '团队管理', '电商', '活动运营', '店铺统筹', '运营经理', '总监', '\r\n                    ', '\r\n        ', '微信分享', '\r\n        ', '\r\n        ', '\r\n    ']"
