link,job,company,salary,area,experience,education,companyType,companySize,direction,address,describe
https://jobs.51job.com/guangzhou-hzq/118917727.html?s=01&t=0,Google投放专员/主管,韩都衣舍电子商务集团股份有限公司,0.5-1万/月,广州-海珠区,1年经验,本科,合资,1000-5000人,服装/纺织/皮革,广州省广州市海珠区中大科技园A座6楼,"['\r\n        ', '岗位职责：', '\xa01、负责Google\xa0AdWords关键词广告、购物广告、展示广告、广告推广投放分析及数据分析，根据分析结果调整竞价推广；\xa0', '2、监控广告的实际投放效果，进行实时优化，并提出和执行相应解决对策；\xa0', '3、独立分析广告投放数据，总结投放问题，拟定解决策略；\xa0', '4、挖掘产品卖点，确定并执行针对产品的推广策略； \xa0', '任职要求：\xa0', '1、全日制本科及以上学历，一年以上独立账户推广经验；\xa0', '2、能够独立分析推广账户出现的问题，根据数据，分析并提出改进方案；\xa0', '3、能够熟练操作Google\xa0Adwords账户，了解竞价排名规则、优化技巧；\xa0', '4、能够熟练使用Google\xa0Analytics等流量分析跟踪软件；\xa0', '5、有过往成功案例、外贸电商行业adwords实操工作经验者优先。\xa0', '\r\n                ', '\r\n                                        ', '职能类别：', '网络推广经理/主管', '网络推广专员', '\r\n                                        ', '关键字：', '跨境电商', 'Google推广', '\r\n                    ', '\r\n        ', '微信分享', '\r\n        ', '\r\n        ', '\r\n    ']"
https://jobs.51job.com/guangzhou-hzq/115679703.html?s=01&t=0,淘宝客服兼直播,广州市言土寸电子商务有限公司,4-8千/月,广州-海珠区,无工作经验,大专,民营公司,50-150人,互联网/电子商务,赤岗西路238号金帆大厦东梯5楼,"['\r\n        ', '岗位职责：', '1.\xa0基本熟悉淘宝网站后台操作系统、交易流程及淘宝规则；', '2.\xa0通过淘宝旺旺、电话等方式接待客户、解答疑问，引导并促成交易，进行有效的跟踪，做好售前和售中的服务工作；', '3.\xa0了解产品的属性和卖点，准确适时地推荐给客户，达成销售目标；', '4.\xa0对女装销售有经验，在尺码推荐、服装面料等方面能给到客户清晰的答案；', '5.工作内容除了淘宝客服工作外，还兼服装直播', '6.\xa0早晚两班制。', '任职要求：', '1.\xa0可考虑优秀毕业生，有无经验皆可，有相关电商平台服饰类客服经验优先；', '2.\xa0熟悉操作淘宝，打字速度快；', '3.身高160-165之间，长相清秀', '4.\xa0有较强的客户服务意识、良好的销售技巧；', '5.\xa0有一定的数据分析能力，对客户的购买行为进行有效分析和引导购买；', '6.\xa0有耐心，富有责任感和团队合作精神；', '7.\xa0身体健康，积极乐观，对工作有热情，能抗压，能长期稳定工作。', '加入进来后，你会享受到：', '1、90后主场气氛愉悦、美味的下午茶点心、高额诚意生活补贴；', '2、可以拥有近水楼台先得月和很多帅哥美女共处一室的机会；', '3、也可以拥有与帅哥美女共同出游擦出心灵火花的机会；', '4、可以享受快乐欢愉的生日会及生日带薪假期', '6、可以来场我消费我快乐的任性，而不用担心成为卡奴；', '7、能享受各类节日礼物和季度团建活动；', '8、按国家规定各种年假、婚假、分娩假、产检假等有薪福利假期；', '9、可享受住宿补贴，工作时间：早上9:30-晚上18:30，单休制；', '10、能享受广州市五险', '如果你：富有创造力和激情；', '渴望温暖活力的大家庭；', '想要工作生活完美结合，丰富充实；', '希望拥有提升自我、实现自我价值的平台；', '相信通过努力就可以创造属于自己的辉煌；', '欢迎加入我们，我们在这里等你！', '\r\n                ', '\r\n                                        ', '职能类别：', '网店/淘宝客服', '主播/主持人', '\r\n                                        ', '关键字：', '网店直播', '淘宝客服', '\r\n                    ', '\r\n        ', '微信分享', '\r\n        ', '\r\n        ', '\r\n    ']"
https://jobs.51job.com/guangzhou-lwq/119537084.html?s=01&t=0,连锁门店运营总监（形体美学店）,广东人联网电子商务有限公司,2.5-3.5万/月,广州-荔湾区,5-7年经验,大专,民营公司,150-500人,互联网/电子商务,广州市荔湾区花地大道南404号绿瘦健康产业园,"['\r\n        ', '职位描述：', '\xa01、负责集团形体美学门店的整体运营工作，对门店运营指标（包括服务人次、客户满意度、销耗额、转化率、销售额等）负责。\xa0', '2、与集团业务联动，负责承接集团客户线下项目，提升客户满意度。，', '3、负责制定门店运营策略，开拓市场业务，进行相关的宣传推广，并推动相关措施落地执行。', '4、负责管理门店日常经营事务，包括制定和优化门店日常管理流程、团队建设、绩效管理、人才梯队培养、门店运营规范和标准建设。', '5、负责门店运营有关商品、促销、培训、新零售等所有相关工作的落地执行。\xa0', '6、负责与门店运营相关的跨部门协调和沟通工作。\xa0', '7、负责新店项目跟进（包括新店选址、人员安排、营业用品、装修、证照办理等协调跟进工作）。', '任职要求：\xa0', '1、大学专科以上，5年以上大型会所、连锁线下门店运营管理经验，对门店实体店运营有丰富的经验及技巧。', '2、具有较强的责任心、市场意识，较强的服务意识和成本意识。\xa0', '3、较强的数据分析能力，具备整合资源能力和业务推进能力，善于沟通。', '福利待遇：', '舒适的办公环境、广阔晋升空间、免费上下班车；', '还有：员工食堂、员工宿舍、部门旅行、法定节假日等等；', '还有老板一言不合就团建的活动在等着你。', '\r\n                ', '\r\n                                        ', '职能类别：', '销售总监', '大客户管理', '\r\n                                        ', '关键字：', '新店统筹', '门店运营', '美业经验', '客户满意度', '销售', '服务', '\r\n                    ', '\r\n        ', '微信分享', '\r\n        ', '\r\n        ', '\r\n    ']"
https://jobs.51job.com/guangzhou-lwq/119390180.html?s=01&t=0,物流专员,广州外宝电子商务有限公司,4-5千/月,广州-荔湾区,1年经验,招2人,民营公司,500-1000人,贸易/进出口,逢源路128号金升大厦8楼803室,"['\r\n        ', '职位信息', '1、负责跨国境电商平台日常订单以及内部发货流程的管理；', '2、根据每个国家地区，负责产品的尺寸不同分配物流；', '3、监控渠道运转情况，发现问题及时汇报和调整，处理后续问题件；', '4、负责业务流程衔接，解决供应链环节的突发问题、保证整个供应链流程的顺畅；', '5、完成总经理吩咐的工作。', '岗位要求：', '1、大专及以上学历懂基本英语，物流管理相关专业优先考虑；', '2、1年以上外贸电商公司国际物流操作经验，1年以上仓库管理经验，熟悉相关操作流程和ERP系统优先考虑；', '3、工作认真负责，积极主动，有耐心，善于沟通、效率较高；', '4、熟练使用常用office软件；', '5、沟通力良好执行力强，能承受较大的工作压力，具有良好的团队合作精神；', '福利待遇： ', '1、工资结构：底薪+极具竞争力的绩效奖金 ', '2、社会保障：购买社会保险（养老、生育、工伤、失业、医疗保险）和 公积金 ', '3、餐费补贴：公司按出勤天数发放午餐补贴10元/天 ', '4、全勤奖励：公司设员工全勤奖每月100元 ', '5、晋升机制：完善的晋升考核奖励机制，管理岗位晋升 及专业技能纵深 双向发展通道 ', '6、培训体系：公司为新员工提供入职培训及专业培训，入职引导人一对一帮带；不同级别及不同岗位均有相应专业及管理培训，不断提高员工的综合能力。 ', '7、员工生活：通过业绩回报获取团建基金，丰富多彩的户外活动、旅游、聚餐、拓展等 ', '8、假期福利：国家法定节假日 及带薪病假、婚假、产假、生育津贴、丧假等。 ', '9、人文关怀：停不下的糖果小点心，为你的工作加些甜 ', '10、年度调薪：每年有1次调薪机会 ', '11、试用期：1-3个月，我们给予新人莫大的认可与鼓励，以能力和结果为导向，帮助你提前达成目标，提前转正 ', '【工作时间】：周一-周六，一天工作8小时；每周日休息 ', '【公司地址】：荔湾区逢源路128号，金升大厦8层803 ', '【仓库地址】：荔湾区坦尾（桥中），南域家居建材D栋303； 地铁5号线坦尾站，步行5分钟', '\r\n                ', '\r\n                                        ', '职能类别：', '物流主管', '物流专员/助理', '\r\n                                        ', '关键字：', '物流', '仓管', '仓库', '物流', '跨境电商', '\r\n                    ', '\r\n        ', '微信分享', '\r\n        ', '\r\n        ', '\r\n    ']"
https://jobs.51job.com/guangzhou-pyq/119118964.html?s=01&t=0,销售精英,淘商城电子商务创意产业园,30-40万/年,广州-番禺区,2年经验,中专,民营公司,500-1000人,互联网/电子商务,大龙街华宝玻璃（隔壁）长沙路27号3101、3102,"['\r\n        ', '和昊信地产合作，年收入能达到 30-80 万', '1.高分红制，提成高达 40%，例如一张单销售额20万，提成8万元；', '2.平台直接分客户，告别陌拜和工作量大的电销；', '3.平台只分配大客户给您，足够多的大客户支撑。', ' ', '要求：', '热爱销售，谈判高手，自律性强', '有工业地产销售经验优先。', '\r\n                ', '\r\n                                        ', '职能类别：', '销售代表', '房地产销售', '\r\n                                        ', '关键字：', '销售', '\r\n                    ', '\r\n        ', '微信分享', '\r\n        ', '\r\n        ', '\r\n    ']"
https://jobs.51job.com/foshan-sdq/115714518.html?s=01&t=0,电商运营总监,广东领智电子商务有限公司,40-50万/年,佛山-顺德区,8-9年经验,本科,民营公司,少于50人,互联网/电子商务,龙江镇联塑工业区C5（联塑电商）,"['\r\n        ', '1. 负责制定公司的电商运营发展战略，制定运营指标、年度销售计划，统筹公司营销管理工作，推动公司的年度销售目标顺利完成；', '2. 负责组织策划并实施产品选款、市场推广、店铺运营、市场研究等活动的推广方案和相关预算，组织、整合相关资源并推动方案的实施，监督实施效果；', '3. 根据公司的产品进行整体的产品线规划和梳理，规划产品的定价、管理产品的成本、利润和价格；', '4. 负责公司电商运营部门的日常运营管理，制定运营策略、方案并组织实施；', '5. 负责现有各平台管理，整合各渠道资源，新渠道的拓展开发方案制定、业务洽谈等；', '6. 负责分析行业竞争对手的策略、市场营销策略、手段，及时制定应对措施，不断调整、完善、优化公司的策略与方案；', '7. 负责新老客户关系的开发与维护，建立顺畅的客户沟通渠道；', '8. 根据公司经营方针及部门业务需要，合理设置部门架构、优化业务流程，合理配置人员，建立部门的绩效考核、奖惩方案、并对部门绩效目标完成情况负责；', '任职资格：', '1. 全日制统招本科以上学历，能独立负责电商全面运营工作；', '2. 5年以上电商运营及团队管理经验，专业性强，丰富的电子商务（淘宝、天猫、京东等平台）的整体运营操作经验；', '3. 熟悉线上渠道的各种推广手段及规则，针对不同的推广渠道，开展营销活动，协调各方面资源配合执行； ', '4. 具有敏锐的市场触觉，较强的应变能力、领导能力、沟通谈判能力和独立开拓市场能力； ', '5. 有建材行业运营管理者优先考虑。', '福利待遇：', '1. 年薪40-50W，购买五险一金；', '2. 不定期开展公司内部培训及外派培训；', '3. 提供免费公寓住宿，班车接送；', '4. 公司配置图书馆、茶水间、抽烟室，并配置冰箱、饮水机、微波炉、消毒柜等电器满足大家的生活需要；', '5. 公司设有饭堂，多种用餐方式，菜品丰富，享有餐费补助；', '6. 双休，享有带薪年假、法定节假日，不定期的带薪旅游、公司聚餐、节日礼品、下午茶活动等员工福利；', '\r\n                ', '\r\n                                        ', '职能类别：', '电子商务总监', '网站运营总监', '\r\n                                        ', '关键字：', '电商运营管理', '店铺运营', '产品优化', '客户管理', '电商运营', '运营', '网站运营', '电子商务', '产品推广', '促销策划', '\r\n                    ', '\r\n        ', '微信分享', '\r\n        ', '\r\n        ', '\r\n    ']"
https://jobs.51job.com/guangzhou-byq/110654846.html?s=01&t=0,网店客服/天猫客服/京东客服 (职位编号：003),广州尊尚电子商务有限公司,3-6千/月,广州-白云区,2年经验,中专,民营公司,少于50人,互联网/电子商务,嘉禾望岗华英路18号嘉禾汇402室,"['\r\n        ', '岗位职责：', '1、通过千牛/旺旺/咚咚等聊天工具对天猫及京东进行售前导购，解决客户提出的各种问题，达成交易；', '2、运用各种方式对自己接待的订单进行催付款，提升咨询付款转化率；', '3、对于客户使用过程中，遇到的简单的使用问题，进行解答；', '4、引导客户在购买后做出好评，提升店铺DSR评分；', '5、负责店铺后台未发货订单的检查，督促相关部门尽快发货；', '6、完成上级领导临时安排的其他工作。', '任职要求：', '1、中专以上学历，有淘宝售前销售经验优先考虑；', '2、打字速度在60/分钟以上；', '3、耐心，细心，情绪管理能力强，并且热爱客服工作；', '4、有较好的沟通能力和较强的逻辑思维应变能力；', '5、具备良好的服务意识和销售意识；', '工', '作时间：早班 8:30-17:30， 晚班：14:30:00-23:00 做六休一', '薪资结构：底薪+ 业绩提成', '【根据经验程度，待遇可面议】', '在尊尚（ZSUN）', '我们重视每一位有梦想、想改变现状的年轻人，只要你有一颗进取心、积极的态度及良好的执行力，', '便可获得更多的实战机会、系统化的扶持培养及全方位能力的提升。还在犹豫什么？赶快行动吧！', '工作地址：广州市白云区嘉禾望岗嘉禾汇A座402室', '嘉禾望岗地铁G口直通嘉禾汇', '电话：13378680707\xa0李生', '邮箱：lixw1218@163.com', '有意者请将详细简历发送到以上邮箱。', '\r\n                ', '\r\n                                        ', '职能类别：', '网店/淘宝客服', '网络/在线销售', '\r\n                                        ', '关键字：', '网店客服', '天猫客服', '网络销售', '电商客服', '售前客服', '网店销售', '在线销售', '京东客服', '淘宝客服', '\r\n                    ', '\r\n        ', '微信分享', '\r\n        ', '\r\n        ', '\r\n    ']"
https://jobs.51job.com/guangzhou-byq/119191718.html?s=01&t=0,采购员,易时代电子商务（广州）有限公司,3-6千/月,广州-白云区,1年经验,大专,民营公司,150-500人,贸易/进出口,广州市白云区石井街道大朗南街20号（大朗中学附近400米处，惠美家超市对面）,"['\r\n        ', '岗位职责：', '1、开发新供应商，对供应商进行管理、维护；', '2、向供应商询价，采购评估，采购订单，催货，运输与交货等工作；', '3.、定期库存等数据，整理出清货单、报损单，提高库存周转率；', '4、 与仓储部，销售部密切合作，保证产品及时发货，入库；', '5、 严格按采购计划采购，做到及时、合理降低物资积压和采购成本。', '任职要求：', '1、学历不限，半年以上采购经验优先考虑；', '2、熟悉采购流程，良好的沟通能力、应变能力、谈判能力和成本意识；', '3、熟练使用办公软件。', '团队特色：', '我们是――', '90后―95后主流的年轻团队', '来自全国各地的大专本科生团队', '有梦想肯努力，下一个合伙人就是你', '我们有――', '1、每年2次-4次的调薪机会；', '2、优秀员工成为合伙人股权激励-共享收获果实；', '3、购买五险；', '4、节假日福利；', '5、大小周制（周六15:30下班）；', '6、带薪年假：工作满1年员工，每年5天带薪年假；', '7缤纷的节假日活动，生日福利，花样下午茶；', '8、多彩的文娱活动：生日惊喜、举行羽毛球赛、爬白云山，每季度外出活动。', '我们要――', '寻找下一个梦想合伙人', '诚信坚持的你', '这是一个***的时代，要做***的自己；快来易时代吧，创下属于你的数据奇迹，发挥你的', '运营奇才，释放你的洪荒之力，燃烧吧，你的小宇宙！！！', '公司地址：广州市白云区石井街道大朗南街20号（距离大朗中学400米，惠美家超市（可导航定位）对面），可乘坐公交523A到陆祖庙步行十分钟可到达。', '\r\n                ', '\r\n                                        ', '职能类别：', '采购员', '\r\n                                        ', '关键字：', '采购员', '电商采购员', '外贸采购员', '跨境电商', '电子商务', '采购跟单', '\r\n                    ', '\r\n        ', '微信分享', '\r\n        ', '\r\n        ', '\r\n    ']"
https://jobs.51job.com/guangzhou-thq/113980658.html?s=01&t=0,红酒销售经理,南舫酿造（广州）电子商务有限公司,1-2万/月,广州-天河区,2年经验,大专,民营公司,少于50人,批发/零售,黄埔大道西路100号之一富力盈泰大厦A塔,"['\r\n        ', '1、负责加盟、经销、批发客户的开拓及维护；', '2、根据公司经营方针及市场信息，完成经营目标；', '3、负责经销商的运营与指导、解决经销商经营过程中的问题，维护良好的合作关系；', '4、全面落实各类推广活动和广告宣传，保证经销商的良好运营，提升经营业绩；', '5、负责开拓市场业务，达成开拓目标；', '6、所辖渠道运营的培训和管理，提升其专业能力；', '7、完成上级领导交代的其它工作。', '任职资格：', '1、', '两年以上小众红酒行业销售经验，熟悉渠道拓展、维护及管理，一线相关行业企业工作经历者优先考虑；', '2、学历不限，性别不限，具有红酒类销售经验，清晰了解红酒销售市场现状；', '3、热爱销售工作，有良好的沟通能力和服务意识，能承受较大的工作压力，执行能力强； ', '4、具备较强的市场分析，营销，推广能力和良好的人际沟通，协调能力；', '5、拥有良好的沟通合作技巧及丰富的渠道建设经验。', '\r\n                ', '\r\n                                        ', '职能类别：', '销售经理', '\r\n                                        ', '关键字：', '渠道销售', '直销销售', '\r\n                    ', '\r\n        ', '微信分享', '\r\n        ', '\r\n        ', '\r\n    ']"
https://jobs.51job.com/guangzhou-byq/109211047.html?s=01&t=0,自建站/Shopify/运营/推广/主管,深圳市香蕉电子商务有限公司,0.6-1.5万/月,广州-白云区,1年经验,大专,民营公司,50-150人,互联网/电子商务,广州白云区永泰学山文化创意谷（永泰地铁站附近）,"['\r\n        ', '岗位职责：', '1、负责公司海外独立站的搭建、完善与维护；负责独立站运营，包括产品上下架、文案编辑、订单管理工作；', '2、通过市场调研、与竞争网站对比分析，顾客需求分析、并根据公司的产品与服务及客户需求，对网站流程进行优化；制定并组织实施公司网站的SEO优化方案，提升网站关键词的搜索排名；', '3、制定合理的推广计划，策划推广活动与产品用户互动，进行产品用户管理，吸纳更多用户，提升活跃度；利用YouTube、Instagram、Facebook、Twitter等社交渠道，以及网络红人，进行独立站的推广，并深入挖掘开拓新的推广方式和平台，提高独立站知名度；', '4、负责线上推广创意策划及效果优化，Google SEO优化，进行Facebook,Google的广告投放；', '5、做好客户满意度服务，提高新客户注册率、交易量及交易频次，提高会员活跃度和网站价值及品牌粘性；', '6、制定周期推广和销售目标，并且实现与执行计划；', '7、定期整理分析运营的各项数据，及时撰写运营分析报告，并提出合理化建议。', '任职要求：', '1、大专及以上学历，英语4级及以上，熟练的英语表达和沟通能力；', '2、1年以上独立站运营推广经验，熟悉相关建站流程及网站建设，能完成独立站团队建设从0到1；', '3、善于利用多种网络推广手段，擅长SEM及SNS推广；懂Google Adwords，Facebook推广；熟练掌握BBS 、博客、软文、社区推广、点评网站、问答平台等及其它推广方式；', '4、懂得操作常用的网页制作软件和网络搜索工具，了解网站开发、运行及维护的相关知识；', '5、具有良好的责任心、学习能力和沟通能力，具有敏锐的数据分析能力，品牌包装推广能力，以及独立站活动创意策划能力；', '6、有较强的创新与市场分析、营销、推广能力和执行力并愿意在跨境电商行业长期发展。', '福利待遇', '一、上班时间：每天7.5小时工作制，大小周轮休，不强制加班、不倒班；', '二、培训：完善的培训体系，提供全方位的在职培训；广阔的学习和发展空间，针对员工个人兴趣及发展意愿量身制定职业发展规划', '三、薪资待遇：基本工资或底薪+提成/绩效奖金（正式员工每年享有2次年度调薪机会）+年终红包；', '四、福利：', '1、福利保障：公司为员工办理五险，并为经常外出办事的员工办理商业保险；', '2、公司福利：全勤奖、工龄奖、生日（派对）祝福、旅游、聚餐、拓展活动、员工关怀、小语种能力奖金、三八妇女节关怀礼物等；', '3、享受国家法定节假日；', '4、带薪假期：员工享有各类带薪假，如年假、婚假、孕检假、产假、陪产假、丧假等；入职满1年的员工，年休假为5天，满2年为6天，最高可享每年15天年假；', '香蕉国际正不断壮大，广州分公司现已成立，需要一群有激情有活力的年轻人加入，诚邀您成为我们的一员！', '在灵活自由的公司氛围中，实现您的职业及个人发展目标。', '欢迎您的加入！', '上班地址：广州分公司 广州市白云区永泰学山文化创意谷（永泰地铁站附近）', '\r\n                ', '\r\n                                        ', '职能类别：', '网站运营专员', '电子商务专员', '\r\n                                        ', '关键字：', '外贸', '跨境电商', '独立站运营', 'shopify', '自建站', '推广', '\r\n                    ', '\r\n        ', '微信分享', '\r\n        ', '\r\n        ', '\r\n    ']"
