link,job,company,salary,area,experience,education,companyType,companySize,direction,address,describe
https://jobs.51job.com/shenzhen-baq/119140178.html?s=01&t=0,外贸跟单员,深圳麦古电子商务有限公司,0.8-1.5万/月,深圳-宝安区,3-4年经验,本科,民营公司,少于50人,互联网/电子商务,深圳市宝安区西乡大道230号艺峦大厦3座501,"['\r\n        ', '1.负责公司大客户订单的跟进、维护以及业务订单的跟进；', '2.根据客户要求协调内外部资源，跨部门沟通协调，保质保量按期交货；', '3.负责订单包装的确认，协助业务部及供应链同事做好客户验货前的准备工作；', '4.协调沟通出货订舱工作，确保产品顺利出运，及时跟进反馈货运情况；', '5.负责处理客户订单投诉，及时将投诉情况反馈给相关部门负责人，并协助处理相关事务；          ', '6.统筹国内展会相关工作；                                                                     ', '7.公司新产品的CE认证申请，及时更新现有产品的证书。', '任职要求：', '1、本科以上学历，2年以上国际业务跟单或者外贸业务员经验；', '2、英语四级以上，良好的英文书面及口语表达能力；', '3、有操作空海运出口订舱，报关，拖车安排的工作经验尤佳；', '4、具备良好的内外部沟通协调能力，应变能力；', '5、有较强的责任心，良好的服务意识，抗压能力强。', '福利待遇：', '1、薪酬：底薪+提成+绩效构成，拥有在行业内颇具竞争力的薪资及激励机制；', '2、培训机会：分阶段为员工组织系统培训，并提供公平公正的内部双向晋升制度。', '3、节日慰问：公司在端午节、中秋节、女王节及圣诞节等重大节日为员工发放节日慰问品；', '4、员工活动：每年举行一次大型年会活动、员工生日会以及各项文娱活动，丰富员工的业余生活；', '5、其他福利：员工入职满一年享受体检福利、每天美味的下午茶、丰厚的年终奖品、国内外旅游；', '\r\n                ', '\r\n                                        ', '职能类别：', '高级业务跟单', '业务跟单', '\r\n                                        ', '关键字：', '外贸跟单', '贸易跟单', '外贸专员', '外贸助理', '跟单', '外贸销售助理', '\r\n                    ', '\r\n        ', '微信分享', '\r\n        ', '\r\n        ', '\r\n    ']"
https://jobs.51job.com/shenzhen-lgq/119134085.html?s=01&t=0,亚马逊美工,深圳市月光树电子商务有限公司,6-8千/月,深圳-龙岗区,1年经验,大专,民营公司,少于50人,互联网/电子商务,中兴路143号鸿达大厦3楼303室,"['\r\n        ', '一、岗位职责', '1. 负责公司产品图片拍摄以及详情页制作和主页制作;', '2. 配合支持优化店内宝贝描述，美化产品图片，制作商品资料，结合商品的特性制作图文并茂、有美感、有购买吸引力的描述模板。', '3. 配合运营团队要求更新/优化产品图片、视频；', '4. 制作banner、海报，配合公司做好文化及营销活动的策划与设计；', '5. 配合运营策划推广活动，并参与执行；', '6. 完成上级交办的其他任务；', '二、任职要求', '1. 美术、平面、广告等相关专业优先考虑，有1年以上电商专职美工经验者优先；', '2. 对跨境电商行业有强烈的兴趣，有亚马逊平台经验者优先考虑；', '3. 精通photoshop、C4D、AI（CDR）、Dreamweaver等图形图像视频处理软件；', '4. 具备摄影基础知识，能操作单反数码相机并熟悉懂摄影布光技巧；', '5. 具备优秀的3D/2D、摄像、视频、美术设计技能，有较强视觉营销效果及表现能力；', '6. 善于色彩搭配，有较强视觉效果表现能力，善于创新，拥有良好的设计感觉和大胆的设计思想，有独立设计、制作能力；', '7. 有创意，勇于提出自己的创作灵感；', '8. 善于与人沟通，工作细致耐心，责任心强，有团队精神、抗压性强。', '\r\n                ', '\r\n                                        ', '职能类别：', '平面设计师', '\r\n                                ', '\r\n        ', '微信分享', '\r\n        ', '\r\n        ', '\r\n    ']"
https://jobs.51job.com/shenzhen-lgq/119017441.html?s=01&t=0,亚马逊销售助理 (职位编号：YF039),深圳禹锋电子商务有限公司,0.5-1万/月,深圳-龙岗区,无工作经验,大专,民营公司,少于50人,互联网/电子商务,横岗街道窝杜村联合路31-1四楼（永湖地铁站C出口进来500米）,"['\r\n        ', '1、大专以上学历，', '\xa0 \xa0 \xa0无需经验；', '2、学习并执行Amazon平台及推广方式，结合各渠道的特色和公司情况制定推广计划，监督实施，并定期针对推广效果进行跟踪、评估，并提交推广效果的统计分析报表，及时提出营销改进措施，并给出切实可行的改进方案；', '3、有较强的文案组织能力和线上活动运营能力；', '4、公司给予平台，充分发挥自我能力的展现，和公司分享利润。', '5。 主动沟通问题，有团队合作精神。', '\r\n                ', '\r\n                                        ', '职能类别：', '销售助理', '\r\n                                        ', '关键字：', '亚马逊', '销售', '助理', '\r\n                    ', '\r\n        ', '微信分享', '\r\n        ', '\r\n        ', '\r\n    ']"
https://jobs.51job.com/shenzhen-nsq/118750582.html?s=01&t=0,业务跟单,深圳前海高丽街电子商务有限公司,6-8千/月,深圳-南山区,无工作经验,招3人,民营公司,少于50人,贸易/进出口,前海路丽湾大厦A栋2203-2205,"['\r\n        ', '1、协助业务与客户之间的日常工作沟通和信息传递。', '2、ＥＲＰ系统制单，跟踪。', '3、协助订单的处理，订单确认、指令传达、跟踪落实等。', '4、能独立处理工作中的各种问题，应变能力强，协调客户之间事项。', '５完成上级交付的其他工作任务。', '6．跟踪每张单订单的生产并将货品顺利的交给客户，收回应收回的款项。', '7．同新、旧客户保持联系增加沟通，了解客户所需。', '8．接收客户的投诉信息，并将相关的信息传递到公司的相关部门。', '9．掌握、了解市场信息，开发新的客源。', '10．做好售后服务。', '业务跟单岗位职责', '一、客户订单，按合同评审要求审核订单后传达到相关部门，跟踪审核结果，并将订单异常情况与客户协调处理。', '二、及时处理订单变更及客户要求事宜，并通知相关部门。', '三、客户资信、客户订单、文件分发的统计、和保存。客户报价单、报价资料之整理及归档。', '四、负责客户投诉登记、初步处理、信息传递及处理结果跟踪。', '五、经常与客户沟通，保持良好关系，争取客户订单。', '六、按顾客满意度测量程序对客户满意度进行调查及汇总分析。', '七、保守企业商业秘密。', '八、上级交办的其他工作。 ', '\r\n                ', '\r\n                                        ', '职能类别：', '大客户销售', '\r\n                                ', '\r\n        ', '微信分享', '\r\n        ', '\r\n        ', '\r\n    ']"
https://jobs.51job.com/nanchang/113810811.html?s=01&t=0,Java高级开发工程师,上海钢银电子商务股份有限公司,1-1.6万/月,南昌,3-4年经验,本科,上市公司,1000-5000人,互联网/电子商务,紫阳大道3333号绿地紫峰大厦9F/908,"['\r\n        ', '岗位职责：', '1.参与项目的需求分析，负责项目的架构设计、模块设计和开发。', '2.负责指导软件工程师详细设计和开发。', '3.负责解决项目中的技术难点和技术把关。', '4.协助项目经理做好项目管理。', '任职要求：', '1. 精通Java 语言、以及常用的设计模式，对使用Java多线程，共享变量的操作、死锁有较深入的认识，了解常用的工具对Java应用程序进行诊断方式', '2. 熟悉Scala，Python语言，熟练再Linux系统环境开发，应用部署等操作，能够使用Java或scala语言编写Mapreduce、Spark等应用程序，以及相关的性能优化方式', '3. 熟悉常用的数据结构和算法，有再业务或分布式系统中解决负载均衡，数据一致性保证的经验尤佳', '4. 熟练掌握多个大数据相关组件的使用、原理实现、常用的性能优化方案、可以应用的场景如Hadoop，Hbase，Zookeeper、Hive、Sqoop 、Kafka，能够独立完这些组件的部署和基本优化。理解Nosql，熟练使用Mysql，Oracle数据库', '5. 熟悉对分布式系统的监控、运维、故障恢复，高可用配置', '6. 熟练使用Maven、Gradle、Nexus 、Hudson、Git 等项目管理、持续集成、代码管理工具，能独立搭建开发项目骨架并能制定开发规范', '7. 熟练使用常用的测试框架，重视单元测试，集成测试，保证代码质量，并定期对其不合理和可优化的地方进行重构', '8. 有快速和持续学习的能力，动手能力强，有进去心、责任心强', '9. 本科以上学历。', '福利待遇：', '1、带薪培训：系统化培训体系，新员工带薪培训', '2、社会保险：提供完整的五险一金', '3、各类补贴：享受员工的交通补贴、午餐津贴等', '4、法定假日：法定节假日礼品及祝福', '5、生日祝福：员工生日的礼物及祝福活动', '6、班车服务：免费提供6条不同线路的班车上下班（集团总部）', '7、带薪年假：按照劳动法实行带薪年休假制度', '8、健康体检：每年享受年度员工体检', '9、拓展旅游：优秀员工拓展活动及旅游奖励', '工作地址', '南昌市高新区紫阳大道3333号紫峰大厦（艾溪湖大桥东桥头绿地中心）', '\r\n                ', '\r\n                                        ', '职能类别：', '高级软件工程师', '\r\n                                        ', '关键字：', 'java工程师', '\r\n                    ', '\r\n        ', '微信分享', '\r\n        ', '\r\n        ', '\r\n    ']"
https://jobs.51job.com/shenzhen-baq/112232589.html?s=01&t=0,网店模特,深圳前海壹上电子商务有限公司,0.8-1万/月,深圳-宝安区,无工作经验,大专,民营公司,少于50人,互联网/电子商务,宝安区创业二路125号创锦1号D栋4F,"['\r\n        ', '我们是女装！！！男生别投简历了。。。 ', '1、负责日常新品的服饰拍摄拍摄', '2.、身高162cm-170cm，100斤以内。可以接受出差外拍', '3、肢体语言丰富，有较强的镜头感，表现力强，能配合摄影师高效率高质量地完成拍摄任务（有经验者优先）。', '4.、身上无明显伤疤、腿型线条好优先选择。', '5、有较强的沟通表达能力及领悟能力，能配合摄影师表达产品的感觉。', '6、形象积极、青春、阳光。有网络直播', '\r\n                ', '\r\n                                        ', '职能类别：', '网店模特', '\r\n                                        ', '关键字：', '模特', '淘宝', '服装', '\r\n                    ', '\r\n        ', '微信分享', '\r\n        ', '\r\n        ', '\r\n    ']"
https://jobs.51job.com/shenzhen-nsq/101457423.html?s=01&t=0,商务助理,深圳市优米酷电子商务有限公司,4.5-6千/月,深圳-南山区,2年经验,大专,民营公司,少于50人,家具/家电/玩具/礼品,东方科技大厦2202（深大地铁站A4出口）,"['\r\n        ', '岗位职责：', '负责与品牌方对接及下采购订单', '配合业务人员做好相关辅助工作', '跟踪所下订单反馈物流信息', '协助财务做好发票统计', '协助团队完成其他工作事项', '任职要求：', '专科以上学历，品行好，机敏灵活，具有较强的沟通协调能力', '从事过礼品行业工作者优先考虑', '做事认真、细心、负责', '熟练使用office等办公软件', '具有服务意识，能适应较大的工作压力', '能工作压力和具有一定挑战能力', ' ', '上班时间：五天双休制', '公司福利：正式员工购买五险一金，年终享受13薪外还有额外年终奖金，每年组织1-2次员工旅游活动等等，期待你的加入！', '\r\n                ', '\r\n                                        ', '职能类别：', '商务助理', '\r\n                                        ', '关键字：', '商务助理', '销售助理', '\r\n                    ', '\r\n        ', '微信分享', '\r\n        ', '\r\n        ', '\r\n    ']"
https://jobs.51job.com/dongguan-fgz/98551197.html?s=01&t=0,办公室文员,四川奈思电子商务有限公司,3-4.5千/月,东莞-凤岗镇,1年经验,中专,民营公司,150-500人,互联网/电子商务,塘沥村碧湖路16号安和创新科技园,"['\r\n        ', '1.爱岗敬业，乐于奉献，有较强的事业心和责任感', '2.工作认真细致积极主动，服从各类工作安排；', '3.具有较强的文字综合能力，熟练应用Word、Excel等常用办公软件，有文字写作工作经验者优先。', '4.有良好的语言表达及沟通能力，能灵活处理和协调各类事宜，吃苦精神强。', '5.负责员工入职/离职以及考勤/每月员工工资计算', '6.负责办公报销以及简单的行政方面的采购', '任职要求：', '1、有仓库文员工作经验1年以上，有电商类仓库工作经验者有限考虑；', '2、电脑操作熟练，有使用过ERP系统，使用过电商类ERP优先；', '3、有上进心，', '责任心强，', '工作', '认真细致', '积极主动，服从各类工作安排；', '4、心态稳定，能承受工作压力，有一定沟通协调能力。', '本公司免费提供住宿', '\xa0\xa0', '地址：东莞市凤岗镇塘沥村碧湖路16号安和创新科技园', '\r\n                ', '\r\n                                        ', '职能类别：', '订单处理员', '\r\n                                        ', '关键字：', '打单', '文员', '订单处理', '5S检查', '\r\n                    ', '\r\n        ', '微信分享', '\r\n        ', '\r\n        ', '\r\n    ']"
https://jobs.51job.com/shenzhen-lgq/117140439.html?s=01&t=0,亚马逊运营助理 零经验也可,深圳市锐科斯电子商务有限公司,4-6千/月,深圳-龙岗区,无工作经验,大专,民营公司,少于50人,互联网/电子商务,平湖华耀中心城12栋612,"['\r\n        ', '岗位职责：', '1、担任Amazon客服工作，负责及时处理回复客户售前，售中，售后邮件； ', '2、收集整理产品相关资料，编写产品文案，完善产品信息，上传产品及价格跟进；', '3、负责相关表格制作、数据登记、分析、总结和及时反馈报告；', '4、充分了解客户需求，收集、整理客户反馈的问题或建议，定期向运营人员反馈；', '5、负责执行亚马逊运营的营销推广任务；完成公司规定的任务目标。同时制定个人成长目标，想法设法快速成长，勇于担当。', '岗位要求：', '1、大专以上学历，市场营销，商务英语专业优先，优秀应届毕业生亦可；', '2、英语CET-4以上，听说能力良好，读写能力优秀，熟练操作Excel；', '3、能承受一定的工作压力，有团队精神和服务意识。', '薪酬福利：', '1、按照国家规定购买五险一金。', '2、享受国家法定节假日。', '3、凡入职1年员工，享受带薪年假5天。', '4、公司不定期组织员工聚餐。', '5、提供培训交流机会和员工晋升通道。', '工作时间：', '9:00-12:00,13:30-18:00，大小周；', '公司强调高效工作，无任何强制加班，我们坚信付出和回报成正比。', '还有更多的问题？让我们在面试的时候解答你！', '对我们的了解，你需要走的更近一些', '就像我们不会通过两张纸的简历去定义一个人', '你也不是通过一个网站对我们形成判断', '\r\n                ', '\r\n                                        ', '职能类别：', '网站运营专员', '\r\n                                        ', '关键字：', '亚马逊运营', '跨境电商专员', '亚马逊销售', '亚马逊推广', '\r\n                    ', '\r\n        ', '微信分享', '\r\n        ', '\r\n        ', '\r\n    ']"
https://jobs.51job.com/shenzhen-lgq/117024231.html?s=01&t=0,阿里巴巴国际站外贸业务员,深圳市艺帆电子商务有限公司,0.5-1万/月,深圳-龙岗区,1年经验,大专,民营公司,少于50人,互联网/电子商务,布吉街道布沙路217号富文工业区B栋2楼-231,"['\r\n        ', '工作内容：', '1、熟练操作阿里巴巴国际平台，了解阿里巴巴国际站操作技巧，上传并优化产品。', '2、与客户良好的沟通，解决客户的疑问，及时回复客户的问题，避免客户投诉以及投诉的妥善处理；', '3、负责联系客户、编制报价、参与商务谈判，签订合同', '4、及时处理客户订单，整理出货资料，做好客户的跟进；', '5、新老客户的跟进及维护；', '6、完善店铺各自政策与制度，保持店铺的好评率和良好的信用度；制作销售明细报表，进行分析整理；', '7、利用各种搜索引擎如谷歌、领英、Facebook，ins等开拓海外市场，寻求并跟踪海外客户，达成销售目标', '任职资格：', '1.、大学英语4级或专业4及以上，流利的英文听、说、读、写能力。', '2、国际贸易实务、商务英语、电子商务、市场营销等相关专业优先', '3、熟悉外贸业务流程，有自己独立操作阿里巴巴平台的能力优先', '4、工作有拼劲、能吃苦、有毅力、主动性强、执行力强、责任心强、事业心强', '工作地点： 龙岗布吉富文工业区（大芬油画村附近）', '\r\n                ', '\r\n                                        ', '职能类别：', '电子商务专员', '网店店铺管理员', '\r\n                                        ', '关键字：', '外贸业务员', '阿里巴巴外贸', 'alibaba业务', '\r\n                    ', '\r\n        ', '微信分享', '\r\n        ', '\r\n        ', '\r\n    ']"
https://jobs.51job.com/shenzhen/119597862.html?s=01&t=0,Facebook推广专员,深圳市速贸通电子商务有限公司,0.8-1.2万/月,深圳,1年经验,招1人,民营公司,少于50人,互联网/电子商务,新安街道中粮商务公园3栋503A,"['\r\n        ', '职位信息', '工作职责:', '1、熟练操作Facebook广告投放及优化，深入了解和分析各渠道广告投放机制和策略；', '2、执行每日Facebook广告投放，确保所负责广告账户在规定时间内ROI达标；', '3、通过分析目标人群特点，优化广告投放方案；', '4、从各维度对广告数据进行分析，根据分析结果优化广告；', '5、时刻了解同行的广告策略，及时尚元素跟进，设计并制作广告素材。', '任职资格:', '1、大专及以上学历，英语四级以上；', '2、1年以上亚马逊运营、测评、CPC广告推广经验，有过Facebook帐户操作经验优先考虑；', '3、精通市场营销，懂得对数据进行细分及优化，具有较强的市场分析和判断能力，熟悉海外电商市场；', '4、有工作激情，善于沟通，有团队合作意识，较强的学习能力，有责任心。', '\r\n                ', '\r\n                                        ', '职能类别：', '网络推广专员', '网络推广经理/主管', '\r\n                                        ', '关键字：', 'CPC广告推广', '亚马逊', 'Facebook', '电商测评', 'Youtube', '网络推广', '市场推广', '市场营销', '\r\n                    ', '\r\n        ', '微信分享', '\r\n        ', '\r\n        ', '\r\n    ']"
https://jobs.51job.com/shenzhen-nsq/115221930.html?s=01&t=0,销售经理（出口退税）,广东奥园奥买家电子商务有限公司,1.5-2万/月,深圳-南山区,无工作经验,招1人,民营公司,150-500人,互联网/电子商务,深圳市南山区赤湾一路10号山灵数码A栋01-A155室,"['\r\n        ', '岗位职责：', '\xa0\xa0\xa0\xa0', '1.', '负责对外与各类客户的开发和市场合作，拓展线上、线下合作渠道，完成公司销售指标；', '\xa0\xa0\xa0\xa0', '2.', '定期维护业务合作关系，跟进合作过程中各环节出现的问题，并及时沟通解决和反馈，对整个业务合作的过程和结果负责；', '\xa0\xa0\xa0\xa0', '3.', '负责重要项目的商务谈判，审核合同条款，配合法务，风控起草修改合同条款；', '\xa0\xa0\xa0\xa0', '4.', '负责跟进项目进度，协调对公司内部和外单位的业务流程，直至项目顺利完成。', '\xa0\xa0\xa0\xa0', '\xa0\xa0\xa0\xa0', '任职资格  ：', '\xa0\xa0\xa0\xa0', '1. 本科', '及以上学历，', '5', '年以上市场经验，有丰富的进出口贸易经验和企业客户资源；', '\xa0\xa0\xa0\xa0', '2. ', '快速的学习能力和业务拓展能力，能够快速适应外部环境的变化；', '\xa0\xa0\xa0\xa0', '3. ', '具有良好的服务精神，以及较强的团队协作能力、表达能力等；', '\xa0\xa0\xa0\xa0', '4. ', '有供应链行业经验、海外接单资源的优先。', '\r\n                ', '\r\n                                        ', '职能类别：', '商务经理', '\r\n                                ', '\r\n        ', '微信分享', '\r\n        ', '\r\n        ', '\r\n    ']"
https://jobs.51job.com/shenzhen-baq/119600840.html?s=01&t=0,仓管员,深圳市潮流电子商务有限公司,4.5-6千/月,深圳-宝安区,无工作经验,高中,民营公司,150-500人,互联网/电子商务,捷家宝路9号羿松生态科技园4栋201,"['\r\n        ', '1、负责电商仓库人员的管理，确保收获、配货、包装、发货等流程的正常进行；', '2、科学管理货品库位，提出改进方案，合理规划货仓位，保证仓库的使用率；', '3、做好货品在系统内的数量、规格、型号、质量的验收和登记，及时更新电脑数据和手工记账库存数据，对产品质量和数量问题及时反馈汇报；', '4、督促指导货品物资的装卸和搬运工作，做好货品仓位管理，物资的堆放、排列、标示工作；', '5、根据上线电商平台订单安排、打单、配货、打包、发货的流水线作业；', '6、定期与不定期组织盘点，确保帐料实时准确，监督盘点工作和结果分析，并提出改进方案；', '7、登记售后退回件以及返修件的进出库管理。', '任职要求：', '1、高中以上学历，年龄20-35岁，踏实稳重、能吃苦耐劳，做事细心、责任心强;', '2、有电商行业仓库管理1年以上经验，有成品仓库管理经验优先；', '3、熟练掌握出入库作业及仓库管理的方法、规范、流程及操作程序；', '4、熟悉办公软件操作。', '薪资', '试用期薪资范围试用期薪资4200+300饭补', '转正薪资范围转正：4200+300饭补+500绩效', '包住宿', '公司福利：', '1、购买社保、法定节假日正常放假；', '2、公司设有全勤奖、工龄奖、年假、年终奖等福利', '3、不定期组织聚餐、拓展训练、旅游团建活动等；', '4、每月员工生日会、每周下午茶、羽毛球等。', '\r\n                ', '\r\n                                        ', '职能类别：', '网站运营经理/主管', '\r\n                                        ', '关键字：', '电商仓储', '3C数码配件', '\r\n                    ', '\r\n        ', '微信分享', '\r\n        ', '\r\n        ', '\r\n    ']"
https://jobs.51job.com/shenzhen-baq/113258850.html?s=01&t=0,售前客服 西乡（包住）,深圳市铺帮网电子商务有限公司,6-8千/月,深圳-宝安区,无工作经验,中技,民营公司,50-150人,互联网/电子商务,西乡金海路10号华盛辉商业大厦3楼305室,"['\r\n        ', '薪资福利：', '1、底薪：无责任底薪3000元（试用期一个月，浮动式底薪3000-6000）', '2、提成可达到20% （确保员工每一份付出得到大回报和收益）', '3、三个月以后薪资水平为6000元/月-12000元/月', '任职要求：', '1、18-30岁，不限学历不限经验，', '2、对销售有兴趣者优先考虑；抗压能力强。', '工作职责：', '1、电话/微信开发跟踪客户 （公司工作环境好，待遇优。）', '2、服务客户：回访客户，推荐客户，做好客户关系维护。', '工作地址', '深圳市宝安区西乡金海路华盛辉商业大厦3楼305室', '\r\n                ', '\r\n                                        ', '职能类别：', '客服专员/助理', '\r\n                                        ', '关键字：', '客服', '微信客服', '电话客服', '售前客服', '电话销售', '网络销售', '微信销售', '\r\n                    ', '\r\n        ', '微信分享', '\r\n        ', '\r\n        ', '\r\n    ']"
