link,job,company,salary,area,experience,education,companyType,companySize,direction,address,describe
https://jobs.51job.com/shenzhen-ftq/116440130.html?s=01&t=0,市场拓展专员,上海钢联电子商务股份有限公司,0.8-1万/月,深圳-福田区,1年经验,本科,上市公司,1000-5000人,互联网/电子商务,深南路4009号华融大厦1808,"['\r\n        ', '职位描述：', '1、 针对高端客户群体，通过多种营销方式，挖掘大宗商品大数据需求，引导其加入VIP会员服务，并制订与之匹配的企业方案；', '2、独立完成项目的策划与推广，建立和维护良好的客户关系；', '3、掌握市场动态，及时向所在区域销售经理汇报；', '4、项目合同的策划与撰写，参与商务谈判，促成合同签署；', '5、掌握客户需求，建设渠道，主动开拓，完成上级下达的任务指标；', '6、与研究中心、数据中心团队密切配合，达成客户服务目标；', '7、学习与掌握相关技术知识与产品知识，培养敏锐的市场捕捉和判别能力；', '任职要求：', '1、本科及以上学历，有一定的英语读写能力，性格坚韧，具备良好的应变能力和承压能力；', '2、仪表端庄，有涵养；性格开朗大方；思维敏捷；语言表达流畅，沟通协调能力较强；', '3、1年以上销售工作经验，有独立开发客户的能力，精通销售技巧，可把握客户心理，有开拓精神，富有韧性；', '4、具备基本商务洽谈技巧和商务礼仪水平；', '5、具备较强的学习能力和优秀的沟通能力；', '6、有敏锐的市场洞察力；', '7、具有团队意识和服务意识。', '福利待遇：', '1、带薪培训：系统化培训体系，新员工带薪培训；', '2、社会保险：提供完整的五险一金；', '3、各类补贴：享受员工的交通补贴、午餐津贴等；', '4、带薪年假：按照劳动法实行带薪年休假制度；', '5、健康体检：每年享受年度员工体检；', '6、拓展旅游：优秀员工拓展活动及旅游奖励。', '\r\n                ', '\r\n                                        ', '职能类别：', '市场/营销/拓展专员', '销售代表', '\r\n                                        ', '关键字：', '市场拓展', '大客户销售', '销售顾问', '\r\n                    ', '\r\n        ', '微信分享', '\r\n        ', '\r\n        ', '\r\n    ']"
https://jobs.51job.com/shenzhen-ftq/119586116.html?s=01&t=0,仓库主管,深圳市蚂蚁购电子商务有限公司,6-8千/月,深圳-福田区,3-4年经验,大专,民营公司,50-150人,通信/电信运营、增值服务,华强北曼哈C座620（华联发419栋6楼620）,"['\r\n        ', '1. 参与仓储设计，承接公司仓库管理指标，建立仓库管控流程及各项指标体系，并监督落实各项流程和指标体系工作；', '2. 按公司的要求，负责监督仓库的商品车收发存管理，盘点，过程质量、安全等管理工作；', '3. 熟悉项目流程，监控分析仓库数据，通过数据管理保证库内系统高效运转；', '4. 执行和完善仓库的规章制度、规范作业标准及流程，合理调配人力资源，对仓库现场各个工作的监控；提高工作效率，制定预算，降低企业成本；', '5. 制定仓储商品车流程，控制仓储整体出错率，确保仓储业务运作状况符合公司要求；', '6. 建立及时有效的汇报机制,做好仓库各项管理工作的周报、月报等各项运作分析的反馈工作。', '7、大专及以上学历，管理类、物流类相关专业优先考虑；', '8、办公软件运用熟悉，熟悉物流操作流程，有丰富的流程管理操作技能；', '9、熟悉ERP及物流信息管理系统并有实施经验；', '10、良好的沟通及谈判能力，团队管理能力，独立工作能力强。', '\r\n                ', '\r\n                                        ', '职能类别：', '移动通信工程师', '物流主管', '\r\n                                        ', '关键字：', '仓库主管', '仓管员', '仓库管理', '仓管', '\r\n                    ', '\r\n        ', '微信分享', '\r\n        ', '\r\n        ', '\r\n    ']"
https://jobs.51job.com/shenzhen/111516796.html?s=01&t=0,薪酬福利主管,深圳市星品优汇电子商务有限公司,0.6-1.2万/月,深圳,5-7年经验,本科,民营公司,50-150人,互联网/电子商务,福田区益田路6009号新世界中心50楼01室,"['\r\n        ', '工作职责：', '1．预算：制定人力资源年度预算工作，人工成本的统计与分析；', '2．控制：定期审查人力资源各预算的列支情况，对预算的相关指标负责审核及监督，向管理层提供人工成本控制的建议；', '3、政策：收集各地社会保险政策及税收政策；了解各地法律法规中与薪酬福利相关的条款；调查行业企业薪酬水平、福利安排；制定适合公司的薪酬福利标准及相关政策；', '4、绩效：支持业务部门，建立长期激励方案的制定、培训与实施；', '5、人事：薪酬福利的按时、精准计算及发放；', '6、系统：人力资源信息系统的维护、优化；', '7、数据：提供人力资源的相关的数据统计分析工具、数据分析；', '8、管理：培训及指导下属的相关工作。', '9、 数据:HR相关数据收集与分析。', '任职资格：', '1、本科学历，工商管理学、统计学等相关专业优先；', '2、具有5年或以上本模块工作经验；', '3、具有良好的职业操守，责任心强，细致度高；', '4、过往管理HR系统的经验；', '5、数据敏感性强，能通过数据分析为人力资源管理带来支持。', '公司福利：竞争力薪酬―周末双休―法定年假―朝九晚六―优美办公环境―多彩活动。', '\r\n                ', '\r\n                                        ', '职能类别：', '薪资福利经理/主管', '\r\n                                ', '\r\n        ', '微信分享', '\r\n        ', '\r\n        ', '\r\n    ']"
https://jobs.51job.com/shenzhen-lhxq/119571152.html?s=01&t=0,电子工程师,买又买电子商务科技（深圳）有限公司,0.8-1万/月,深圳-龙华新区,3-4年经验,大专,民营公司,50-150人,互联网/电子商务,观澜湖国际大厦7楼i室,"['\r\n        ', '\xa01、对模拟电路、数字电路理论有良好基础；', '2、熟悉各种电子元器件的规格及应用，具备一定硬件电路的设计分析能力；', '3、具有独立设计原理图和PCB的能力，至少熟练使用一种PCB设计软件。如：pads、Cadence、Altium\xa0Designer等。优先pads。', '4、具体一定的小家电产品研发经验，具有宠物用的小家电工作经验更佳；', '5、具有对单片机系统硬件开发经验，熟知C/C++语言开发更佳；', '6、配合结构、软件做好新产品开发以及现有产品优化升级 。', '\r\n                ', '\r\n                                        ', '职能类别：', '电子工程师/技术员', '电子技术研发工程师', '\r\n                                ', '\r\n        ', '微信分享', '\r\n        ', '\r\n        ', '\r\n    ']"
https://jobs.51job.com/shenzhen-baq/119463936.html?s=01&t=0,HA类客户售后客服,深圳市萝趣电子商务有限公司,4-6千/月,深圳-宝安区,1年经验,高中,民营公司,少于50人,电子技术/半导体/集成电路,沙井后亭地铁站D出口同方创意园6栋112,"['\r\n        ', '岗位职责', '1、根据客户、物流服务以及售前客服反映的售后问题，作出合理的解决方案并回复客户；', '2、跟进售后问题解决进度至解决问题；', '3、系统后台的售后问题的处理，差评出路以及数据维护；', '4、整理归纳售后问题的有效信息，并及时更新处理进度，反馈给售前客服以及客户；', '5.日常其他工作', '任职要求', '1、相关天猫、淘宝售后有工作经验者优先；', '2、计算机操作熟练、较强的沟通能力；', '3、具备良好的服务意思、亲和力、性格温和、工作耐心细致、能周到应对各种顾客类型；', '4、能吃苦，做事认真，效率高。', '工作五天八小时制，周末双休！', '\r\n                ', '\r\n                                        ', '职能类别：', '客服专员/助理', '网络/在线客服', '\r\n                                        ', '关键字：', '售后', '客服', '客服专员', '\r\n                    ', '\r\n        ', '微信分享', '\r\n        ', '\r\n        ', '\r\n    ']"
https://jobs.51job.com/shenzhen-lhxq/119570717.html?s=01&t=0,阿里巴巴国际站运营,深圳市微智盛电子商务有限公司,0.6-1万/月,深圳-龙华新区,无工作经验,大专,创业公司,50-150人,互联网/电子商务,龙华新区清庆路文化创意产业园1栋20楼微智盛电子商务有限公司,"['\r\n        ', '工作内容：', '1.\xa0阿里巴巴国际站装修，产品上传，后台数据和关键词进行发布并优化（有美工设计部门协助）\xa0', '2. 通过数据分析，优化关键词等运营技巧提升阿里巴巴店铺的曝光率、询盘量、网站排名；', '3. 定期跟进重点产品，橱窗产品关键词排名趋势并优化；', '4. 跟进阿里后台*近热搜词并符合相关产品的，优先重点优化，提高曝光和转化率；', '5. 定期与客户沟通，反馈平台的情况，结合新情况做相关调整；', '6. 熟悉阿里巴巴国际站后台操作以及相应的推广手段，能够有针对性地制定平台营销策略。', '7. 了解和搜集网络上同行业的动态信息，收集市场竞争信息', '任职资格：', '1. 大专及以上学历，英文四级以上，具备一定的口语读写能力；', '2. 熟悉家居行业优先录用；', '3. 熟悉Alibaba国际站平台规则，优化及产品推广；', '4. 具备良好的团队协作精神，做事认真负责，具有良好的职业道德修养；', '5. 熟练操作外贸直通车及橱窗优化，对关键词排名有自己的见解；', '福利待遇：', '1、工作时间：大小周、月休6天，9:00-12:30,14:00-18:30；', '2、薪酬福利：全勤奖200元/月、提供业内有竞争力的薪酬待遇、公司对于工作表现优秀的员工，每年1-2次薪资调整的机会；享有绩效奖金，业绩奖励金、年终奖金、年终评优、年度调薪、依法享受带薪假期等；', '3、五险一金：入职即可购买五险一金；', '4、员工培训：提供入职培训，专业技能在职培训、不定期为员工组织内外部培训；', '5、节日福利：公司在端午节、中秋节等重大节日为员工发放节日慰问品或购物卡等；', '6、生日福利：公司每月举办员工生日会及发放生日礼品；', '7、关怀活动：入职满一年享有年度体检福利，不定期提供下午茶、定期举行丰富多彩的员工活动（打篮球、羽', '毛球）、部门团建活动、周年庆活动、每年举行一次大型年会等活动；感谢大家为公司的辛苦付出并促进职员之间的沟通交流；', '8、员工旅游：每年一次员工集体旅游+N次公司及部门组织活动（公司灵活安排）', '9、读书会：根据各部门的需要，公司定期购买书籍供大家阅读、学习。', '10、提供公寓级住宿环境（公寓配置空调、热水器、厨房、小阳台3-4人/间），公司为员工配有冰箱和微波炉；', '11、员工晋升：公司为员工提供公平的晋升制度、职业发展多通道；', '12、有一个良好的、轻松的工作氛围和工作环境，年轻化团队，沟通文化简单，不定期组织各项娱乐活动；', '\r\n                ', '\r\n                                        ', '职能类别：', '网站运营专员', '\r\n                                        ', '关键字：', '阿里巴巴', '\r\n                    ', '\r\n        ', '微信分享', '\r\n        ', '\r\n        ', '\r\n    ']"
https://jobs.51job.com/shenzhen-lhxq/117121462.html?s=01&t=0,业务跟单,深圳市新一洲电子商务有限公司,4-6千/月,深圳-龙华新区,1年经验,高中,民营公司,50-150人,互联网/电子商务,和平西路龙军工业园11栋2楼,"['\r\n        ', '薪资构成：底薪+提成', '岗位职责：', '1、负责售前咨询接待，介绍产品，解答客户问题；', '2、负责售后问题，处理客户反馈问题等；', '3、负责公司销售数据整理，以及其它文档的规整工作；', '4、负责销售台帐的建立、应收账款的回收跟进以及对账；', '5、配合上级完成日常工作。', '岗位要求：', '1、中专及以上学历，优秀应届毕业生优先（学历条件不限）；', '2、半年以上客服工作经验相关工作经验；', '3、熟悉使用OFFICE办公软件，普通话标准，流利，善于沟通表达，应变能力强；', '4、有良好的销售服务意识，工作耐心细致。', '【福利待遇】：', '*全勤奖、季度全勤奖、年底奖金、提成等；并每年一至两次调薪机会；', '*无限的成长机会和广阔的晋升发展空间，等你来展示；', '*员工生日party，与寿星一起分享生日蛋糕、各式零食等你来一起享用；', '*不定期聚餐、集体活动、旅游，一起来嗨；', '*公司领导Nice;并集聚一群80、90的帅哥美M，工作氛围轻松、舒心的沟通交流', '*享受国家规定的节假日：带薪年假、婚假、产假等节假日；', '*公司配有无人小超市、烤箱、冰箱、微波炉等可自行带饭；', '*公司配有桌球室乒乓球室、休闲吧等休闲娱乐活动场所。', '更多福利正等待着你们去开拓，如果你有好的点子，欢迎一起分享！', '\r\n                ', '\r\n                                        ', '职能类别：', '商务助理', '客服专员/助理', '\r\n                                        ', '关键字：', '客服', '业务助理', '跟单', '\r\n                    ', '\r\n        ', '微信分享', '\r\n        ', '\r\n        ', '\r\n    ']"
https://jobs.51job.com/shenzhen-lgq/114625126.html?s=01&t=0,仓管员 理货员,深圳市非凡时代电子商务有限公司,5-6千/月,深圳-龙岗区,1年经验,招1人,民营公司,50-150人,互联网/电子商务,横杆银海工业区第9号厂房5楼正整层,"['\r\n        ', '岗位职责：', '1. 遵守公司的流程和程序进行日常货物的整理，收货理货等工作；', '2. 定期对货物进行盘点核对；', '3. 定期对库房进行清理，保持库房的整齐美观，使物资设备分类排列，存放整齐，数量准确', '4. 随时掌握库存状态，保证货物及时供应', '任职要求：', '1. 具备良好的敬业精神，反应灵活，工作认真负责，', '2. 沟通能力和接受能力强，能吃苦耐劳，服从管理，工作主动积极，原则性强；', '仓库地址： 深圳市龙岗区横岗银海工业区第9号厂房5楼整层 （特约车神楼上）', '公交路线：银海工业区\xa0 \xa0 \xa0永湖地铁站A2出口', '我们热忱期待您的加入!', '公司福利：', '1、社保：为员工购买五险、平安商业保险；', '2、培训：不定期安排各项内外部培训，为员工提供多样的学习和发展平台；', '3、调薪：每年6月和12月份有两次调薪机会；', '4、年终奖：年底根据公司运营情况发放丰厚的红包；', '5、食宿：公司提供宿舍（配有空调、衣柜、书桌、WIFI、等）；', '6、旅游：公司每年至少安排一次大型的集体旅游活动；', '7、关怀：每周下午茶、每月团队活动、每月生日蛋糕；国家传统的节日为每位员工送上节日的祝福及礼品；', '8、职业规划：入职享受内部晋升计划；能力强者3-6个月升组长; 一年升主管或者晋升运营其他岗位！', '我们能为您提供：', '1、舒适的办公环境、自由、创新、分享、信任的工作氛围；', '2、充满挑战的工作机会，平等、信任、和谐的企业文化；', '3、有竞争力的薪酬，根据个人绩效评定晋升和加薪；', '4、内外部培训相结合，广阔的发展空间与平台。', '同时我们希望您拥有：', '专业的知识与技能；', '和公司一同起发展的稳健心态；', '不断追求成功的事业心；', '不断创新的精神；', '强烈的责任心和敬业的工作态度；', '团队合作精神。', 'We are a team ：', '如果您没有工作经验，我们可以提供专业的技能培训；', '如果您有丰富的工作经验，期待您的加入和分享；', '我们注重团队合作和分享；良好的工作氛围需要你我共同创造和经营；', '即使你不是工作中的佼佼者，但你若拥有突出的才艺或擅长体育项目者，同样值得我们青睐。', '我们热忱期待您加入我们这个卓越的团队，在思翰数码开拓精彩事业、成就精彩人生。', '\r\n                ', '\r\n                                        ', '职能类别：', '其他', '\r\n                                        ', '关键字：', '仓库管理员', '\r\n                    ', '\r\n        ', '微信分享', '\r\n        ', '\r\n        ', '\r\n    ']"
https://jobs.51job.com/shenzhen-lgq/117591734.html?s=01&t=0,外贸客服 英语客服 速卖通运营助理,深圳易迅通电子商务有限公司,0.6-1.2万/月,深圳-龙岗区,2年经验,大专,民营公司,少于50人,互联网/电子商务,坂田街道光雅园几何电商园1期3楼(坂田手造文化街对面),"['\r\n        ', '需要2年以上工作经验（此岗位为主管储备）', '只要你是：', '★大专或以上学历，英语熟练，读写能力良好，听说可以不做要求。', '★有2年的跨境电商相关经验优先考虑。优秀人员面谈后可放宽条件。', '★良好的英语理解和写作能力，打字速度熟练，一分钟50个字以上；\xa0', '★学习力强，做事细心耐心，性格开朗，能承受压力，不接受玻璃心；', '★对跨境电商行业有浓厚兴趣；有成为店铺负责人和公司管理者的意愿。', '那么欢迎你应聘这个职位。', '你需要做的：\xa0', '1、跟进和处理订单，以专业和热情的服务，回复买家留言和咨询，提高客户下单或回购意愿；', '2、预防可能出现的争议，及时妥善处理投诉，物流问题，纠纷，规避差评，维护店铺数据指标；', '3、上架和优化产品，学习如何进行店铺定位，产品规划，和运营一起制定运营计划和销售政策。', '\xa0', '你能得到的：', '1、薪酬：底薪+绩效奖金，收入高低取决于个人能力和业绩；', '2、福利：入职签订劳动合同，购买五险，享受国家法定节假日；\xa0', '3、工作时间：周一到周五：9:00-12:00,13:30-18:00，大小周轮换；', '4、发展方向：客服主管，店长，运营，合伙人。试用期：2-3个月（表现优秀，提前转正）；', '5、公司处于创业期，发展空间和机会巨大，加入核心团队，一起努力，成为公司合伙人。', '  ', '\r\n                ', '\r\n                                        ', '职能类别：', '贸易/外贸专员/助理', '客服专员/助理', '\r\n                                        ', '关键字：', '外贸客服', '外贸助理', '外贸专员', '外贸跟单员', '电商运营助理', '英语客服', '速卖通客服', '跨境电商客服', 'Eaby客服', 'WISH客服', '\r\n                    ', '\r\n        ', '微信分享', '\r\n        ', '\r\n        ', '\r\n    ']"
https://jobs.51job.com/shenzhen/118204283.html?s=01&t=0,客服专员,深圳市乐兴电子商务有限公司,3.5-6千/月,深圳,1年经验,招3人,民营公司,150-500人,互联网/电子商务,龙岗区新生社区莱茵路14号乐兴商城,"['\r\n        ', '1、熟知公司企业文化、公司产品、服务、总体的市场战略、竞争对手网络推广的相关信息；', '2、在线接待客户咨询、销售、背熟并贯彻公司的“规范的礼貌用语表达方式”；', '3、按照公司发展的战略要求，开发优质潜在客户，积极跟进，促进客户尽快下单，掌握老客户的拿货规律，并及时进行回访跟进；如在工作中遇到任何问题，要及时与销售负责人沟通协商；', '4、熟悉销售的工作流程（从接到订单、订货、发货、售后服务等）；\xa0', '5、处理退换货及客户投诉，中差评等事件；', '6、 部门经理交待的其它临时性事务。', '\r\n                ', '\r\n                                        ', '职能类别：', '客服专员/助理', '网络/在线客服', '\r\n                                        ', '关键字：', '客服电商', '\r\n                    ', '\r\n        ', '微信分享', '\r\n        ', '\r\n        ', '\r\n    ']"
https://jobs.51job.com/shenzhen-nsq/116554992.html?s=01&t=0,行政助理/人事助理(双休/急聘）,深圳市博源电子商务有限公司,5-8千/月,深圳-南山区,无工作经验,中专,民营公司,50-150人,互联网/电子商务,高新南十道深圳湾科技生态园9栋B4座418,"['\r\n        ', '1、负责公司电话接转、前台接待工作；', '2、负责信件、包裹的安排及与快递公司的联系；', '3、负责复印、传真和打印等设备的使用与管理工作，合理使用，降低材料消耗；', '4、负责办公用品、物资采购、领用登记；', '5、负责每月员工考勤、报销统计；', '6、完成上级交办的其它工作。', '任职要求：', '1、20-25岁，160CM以上，性格开朗随和，形象气质佳，有亲和力，衣着整齐大方得体；', '2、 普通话标准，综合素质高，有发展潜力；', '3、有良好的服务意识，熟悉使用电脑、传真机、复印机、打印机等各种办公设备，熟悉使用各种办公软件，如：WPS、Office软件；', '4、具有良好的沟通交往能力，精通各种礼仪常识；', '5、具有一定组织协调能力，思维敏捷，应变能力强；', '6、从事过前台接待工作者优先考虑；', '工作点：深圳南山（地铁2号线科苑/1号线高新园，距离地铁9号线延长线科技城站300米（19年下午年即将开通））', '\r\n                ', '\r\n                                        ', '职能类别：', '人事助理', '行政专员/助理', '\r\n                                        ', '关键字：', '行政前台', '行政文员', '行政助理', '行政专员', '行政助理', '人事行政专员', '人事行政助理', '\r\n                    ', '\r\n        ', '微信分享', '\r\n        ', '\r\n        ', '\r\n    ']"
https://jobs.51job.com/shenzhen-ftq/119390743.html?s=01&t=0,生产模型数据,深圳市倍康美医疗电子商务有限公司,4.5-6千/月,深圳-福田区,无工作经验,招1人,合资,50-150人,医疗设备/器械,天安数码城天吉大厦,"['\r\n        ', '1.\xa0\xa0\xa0\xa0\xa0\xa0\xa0  负责印模的修整，灌注工作，确保最终模型符合设计要求', '2.\xa0\xa0\xa0\xa0\xa0\xa0\xa0  负责模型的扫描，修整，确保扫描数据符号设计要求', '3.\xa0\xa0\xa0\xa0\xa0\xa0\xa0  负责模型室清洁工作，确保模型室台面整洁，设备摆放合理整齐，设备用水用电安全', '4.\xa0\xa0\xa0\xa0\xa0\xa0\xa0  负责扫描设备的日常使用及维护工作，并做好相应记录，确保设备工作正常', '5.\xa0\xa0\xa0\xa0\xa0\xa0\xa0  严格按照作业指导书执行工作', '                    ', '6.\xa0\xa0\xa0\xa0\xa0\xa0\xa0  上级交代的其他任务', '\r\n                ', '\r\n                                        ', '职能类别：', '普工/操作工', '\r\n                                ', '\r\n        ', '微信分享', '\r\n        ', '\r\n        ', '\r\n    ']"
https://jobs.51job.com/shenzhen-nsq/118103444.html?s=01&t=0,合约资料员,润材电子商务有限公司,4-7千/月,深圳-南山区,1年经验,大专,国企,,房地产,深圳市南山区华侨城创意园香山东街LOFT北区A4栋301-302室,"['\r\n        ', '岗位职责：', '1.\xa0按招采协议合同模板，结合报价清单，签订供应、采购合同；', '2.\xa0供货后填报请款资料，向项目发起请款、收款；', '3.\xa0按时审核供应商的请款资料并发起内部审批、付款流程；', '4.\xa0完成对项目的结算；', '5.\xa0整理、归档工作中的各项目数据、台账；', '1.\xa0公司安排的其它工作。', '任职资格：', '1.\xa0专科学历以上，从事建筑行业，有1-3年资料合约相关经验；', '2.\xa0熟练使用office、CAD等办公软件；', '3. \xa0坦诚、自信，高度的工作热情，有良好的团队合作精神，有敬业精神；', '4.\xa0认同华润文化', '\r\n                ', '\r\n                                        ', '职能类别：', '资料员', '合同管理', '\r\n                                ', '\r\n        ', '微信分享', '\r\n        ', '\r\n        ', '\r\n    ']"
