link,job,company,salary,area,experience,education,companyType,companySize,direction,address,describe
https://jobs.51job.com/shenzhen-lhxq/115361669.html?s=01&t=0,英语电子商务专员,深圳市南伽科技信息有限公司,0.8-1万/月,深圳-龙华新区,2年经验,大专,民营公司,50-150人,互联网/电子商务,淘金地大厦E座611(龙华线上塘地铁A出口200米处),"['\r\n        ', '岗位职责：', '1、对国外市场需求进行分析、预测，制定销售计划和指标，开展销售；', '2、协助收集市场销售相关需求信息，汇总并反馈，推荐新产品，积极备货；', '3、负责平台账号状况监督及维持良好运营状态；', '4、处理销售中出现的问题，订单发货及RMA相关事宜，提升顾客的满意度。', '任职要求：', '1、本科以上学历，英语六级或以上；', '2、有欧美市场互联网电子商务相关工作经验，熟悉欧美客户的消费及服务心理者优先；', '3、具备团队合作精神及良好的沟通协调能力；', '4、两年及以上相关工作经验优先考虑。', '\r\n                ', '\r\n                                        ', '职能类别：', '贸易/外贸专员/助理', '\r\n                                        ', '关键字：', '亚马逊', '运营', '销售', '电子商务', '英语', '外贸', '\r\n                    ', '\r\n        ', '微信分享', '\r\n        ', '\r\n        ', '\r\n    ']"
https://jobs.51job.com/shenzhen-baq/114968230.html?s=01&t=0,电子商务助理,深圳市舒马特科技有限公司,4.5-6千/月,深圳-宝安区,1年经验,高中,民营公司,少于50人,汽车及零配件,深圳宝安区71区留仙一路14号龙文达科技园6楼东一A,"['\r\n        ', '1、 跟进公司销售同事  产品发朋友圈 推广等 完成进度', '2、对办公软件熟悉', '3、高效的执行力，能够准确地落实分配的其它工作', '任职要求', '1、对电子商务及网络营销有浓厚兴趣；', '2、思维灵活，善于创新，善于学习新知识；', '3、工作认真、高效、积极进取，优秀的团队合作精神，能适应高压工作环境；', '5、了解电子商务者优先；', '公司福利：', '※购买社会基本养老保险、医疗保险、工伤保险、失业保险、生育保险，统称为社保。', '※公司不定期免费组织员工旅游。', '※入职满一年员工，可享受交通补贴、伙食补贴。', '※按照国家法定节假日，根据公司经济效益给员工发放过节费或礼品。', '※公司不定期组织员工聚餐。', '※带薪假期。', '※公司不定期组织员工技能培训。', '※生日会。', '公司外贸平台：', '1. 付费B2B平台，包括阿里巴巴等外贸平台', '2. 海外展会： 汽车专业法兰克福展会，包括 马来西亚，印度尼西亚，迪拜，巴拿马，墨西哥，莫斯科和上海法兰克福展会', '3. 公司网站推广，公司官方网站，商城等。', '工作地点：宝安区71区兴东社区', '地铁5号线 兴东地铁站D 出口', '百度导航：深圳市舒马特科技有限公司 即可到公司楼下。', '公交车站：新福市场', '工作时间：大小周，每天8小时制', '公司主要网站：', 'www.shumatt.com', 'https://shumatt.aliexpress.com/store/616238', 'http://shumatt.en.alibaba.com', 'http：//www.shumatt.cn/app/TruckBook.apk', '工作地址', '深圳宝安区新安街道办新安71区留仙一路14号龙文达科技园6层东一A', '\r\n                ', '\r\n                                        ', '职能类别：', '商务助理', '\r\n                                        ', '关键字：', '电子商务助理', '\r\n                    ', '\r\n        ', '微信分享', '\r\n        ', '\r\n        ', '\r\n    ']"
https://jobs.51job.com/shenzhen-baq/79627544.html?s=01&t=0,电子商务,深圳日高胶带新材料有限公司,0.3-1.5万/月,深圳-宝安区,1年经验,大专,合资,150-500人,石油/化工/矿产/地质,西乡宝运达物流园C区4楼,"['\r\n        ', '1、在网络上对产品推广、技术情报管理制度；', '2、商务信息的收集、整理、分类，对项目信息时时跟踪；', '3、在网络上寻找客户，并进行跟进；', '4、整理、编制商务文件模板，改进和规范工作流程,收集并对往来商务信函、传真、邮件存档备查；', '5、协助经理有关于网络的工作；', '6、负责商务合同的履行，及时协调和协助解决出现的商务问题；', '7、搜集整理国内外产品发展信息，及时把握产品发展趋势；', '8、相关部门的沟通协调工作。', '\r\n                ', '\r\n                                        ', '职能类别：', '网络推广专员', '电子商务专员', '\r\n                                        ', '关键字：', '胶带', '\r\n                    ', '\r\n        ', '微信分享', '\r\n        ', '\r\n        ', '\r\n    ']"
https://jobs.51job.com/shenzhen-lgq/116501743.html?s=01&t=0,电子商务专员,深圳市志仕电子商务有限公司,0.6-1万/月,深圳-龙岗区,1年经验,大专,民营公司,50-150人,互联网/电子商务,横岗街道银信中心E座15楼,"['\r\n        ', '1、按照店长指定的任务制定运营计划，完成产品维护与突破', '2、根据销售情况实时调整产品的推广以及运营策略', '3、每天做好产品数据整理，同行竞品数据整理', '4、制定优化产品图片与详情，提升产品点击率与转化率，以及店铺关联性', '5、做好货量的预估，产品质量问题的把控。', '6、在保证销售的情况下，***化费用占比控制，扩大经营利润', '7、根据店铺推广预算，制定相应的推广计划，熟悉主流推广方式', '职位要求：', '1、擅长数据分析，选品严谨，有爆品思维', '2、能抗压，有挑战精神', '3、思维清晰，对用户需求有一定的掌控力', '4、执行力强，效率高，协调能力佳', '5、精通网上交易推广流程，熟悉电商各种营销工具，有产品促销活动的组织和策划能力', '6、具备较强的创新与市场分析、营销、推广能力，分析与解决问题的能力。', '7、良好的人际沟通能力、应变能力，具有强烈的责任心和事业心。', '8、对天猫淘宝运营了解，能独立运营店铺。', '\r\n                ', '\r\n                                        ', '职能类别：', '电子商务专员', '网站运营专员', '\r\n                                        ', '关键字：', '电子商务专员', '运营', '天猫运营', '网店运营', '淘宝', '运营专员', '直通车', '钻展', '运营推广', '\r\n                    ', '\r\n        ', '微信分享', '\r\n        ', '\r\n        ', '\r\n    ']"
https://jobs.51job.com/shenzhen-baq/118975752.html?s=01&t=0,全盘会计（电子商务）,深圳市依思电子商务有限公司,6-8千/月,深圳-宝安区,无工作经验,招1人,民营公司,50-150人,计算机软件,宝安大道288号宝源华丰总部经济大厦A座321（西乡地铁站旁）,"['\r\n        ', '岗位职责', '1、负责核查各店铺后台（京东、天猫、拼多多等）经营情况编制每日销售报表和利润表；', '2、负责员工工资、奖金、绩效和提成等核算与发放；', '3、负责销售商品成本核算；公司各供应商、合作商的费用核对与结算，企业日常费用报销的审核；', '4、熟练使用金蝶k3、ERP系统操作；', '5、处理会计凭证，检查会计科目运用是否正确，保证会计核算合规合法，及时准确；', '6、根据规定的成本、费用开支范围和标准，审核原始凭证的合法性、合理性和真实性；', '7、管理会计凭证和报表，认真执行安全、保密制度，管理好会计档案；', '8、负责月度及年度结账和编制各类财务报表；', '9、协助处理公司领导交代的其他事务', '任职资格', '1、财务管理、会计专业，；', '2、具有三年以上独立一般纳税人全盘会计工作经验，能独立处理全盘账务和税务工作；', '3、有电子商务企业工作经验者优先；', '4、熟悉会计准则的财务处理，会计法规和税法，熟练使用财务软件；', '5、良好的学习能力、较强的独立工作能力和财务分析能力；', '6、工作积极主动，责任感强，有良好的沟通能力及团队协作精神。', '上班时间：9:00-18:30，大小周，每天工作8小时。', '西乡地铁口10分钟，国家法定节假日、社保等福利齐全！', '\r\n                ', '\r\n                                        ', '职能类别：', '会计', '\r\n                                ', '\r\n        ', '微信分享', '\r\n        ', '\r\n        ', '\r\n    ']"
https://jobs.51job.com/shenzhen/110654139.html?s=01&t=0,电子商务经理/总监,深圳市英维克科技股份有限公司,2-3.5万/月,深圳,3-4年经验,本科,上市公司,1000-5000人,通信/电信运营、增值服务,深圳市龙华新区观澜街道鸿信工业园9栋,"['\r\n        ', '岗位职责：', '1.负责电子商务团队组建、团队管理等；', '2.负责公司电子商务工作整体运营；', '3.负责电商的渠道策略、产品策略、价格策略、推广策略、促销策略等；', '4.负责电商数据分析，不断优化用户体验，提升订单转化率；', '5.负责市场调研、分析竞争对手，能够有效实现细分市场销售突破；', '6.负责跟进电商销售的进销存，有良好的财务意识，做好相应的预算；', '7.负责行业竞争状况大数据分析，对竞品的市场策略有准确的理解、并能够快速的做出准确的针对性方案；', '8.负责与规划第三方电商平台的业务对接工作；', '9.对电商部门的运营目标负责；', '岗位要求', '：', '1.本科或以上学历，有3年以上电商管理工作经验；', '2.熟悉国内电商行业，熟悉各电商平台的运营环境及规则，对如何打造爆款、提升流量、转化率、客单价有清晰的思路及实操经验；', '3.具有优秀的沟通能力、组织协调能力、良好的策划、执行、逻辑思维能力；', '4.具备较强的创新与市场营运、分析、营销、推广能力，分析与解决问题的能力；', '5.有单独成功运营电商品牌经验者优先。', '\r\n                ', '\r\n                                        ', '职能类别：', '电子商务总监', '\r\n                                ', '\r\n        ', '微信分享', '\r\n        ', '\r\n        ', '\r\n    ']"
https://jobs.51job.com/shenzhen-lhxq/119365592.html?s=01&t=0,电子商务运营,深圳市互联在线云计算股份有限公司,1-1.5万/月,深圳-龙华新区,3-4年经验,大专,上市公司,150-500人,互联网/电子商务,深圳市龙华新区清祥路宝能科技园7栋A座3楼,"['\r\n        ', '岗位职责：', '1、负责对客服部的售前、售后客服专员业务技能等进行指导和培训；', '2、负责市场调查与分析，研究规则及销售促销推广方法，制定及调整各项销售宣传推广策略；', '3、针对不同的推广渠道，开展营销活动，协调各方面资源配合执行；', '4、负责垂直电商平台市场的运营及销售管理工作。', '任职要求：', '1、大专以上电子商务、市场营销类专业，3年以上同岗位工作经验；', '2、能独立带领客服团队，较强团队建设管理能力，统筹和计划能力、擅长线上营销技巧；', '3、熟悉团购活动，产品拍卖等营销活动优先考虑。', '\r\n                ', '\r\n                                        ', '职能类别：', '电子商务经理/主管', '\r\n                                ', '\r\n        ', '微信分享', '\r\n        ', '\r\n        ', '\r\n    ']"
https://jobs.51job.com/shenzhen-baq/67833824.html?s=01&t=0,电子商务业务员,深圳市荣强科技有限公司,0.5-1万/月,深圳-宝安区,1年经验,大专,民营公司,50-150人,原材料和加工,深圳市宝安区前进二路与西乡大道交汇处宝运达信息大厦,"['\r\n        ', '1、利用网络进行公司产品的销售及推广；', '2、负责公司网上贸易平台的操作管理和产品信息的发布；', '3、通过网络进行渠道开发和业务拓展；', '4、有化工产品电子商务从业经历者优先；', '5、完成公司领导交付的工作计划任务。（此岗位需要开发业务，前期电话网络销售为主，拜访客户相结合）', '任职资格：', '1、大专以上学历；', '2、2年以上网络销售工作经验，具有网络销售渠道者优先；', '3、熟悉掌握各种网络销售技巧，有上网开店、论坛斑竹等相关工作经验，熟悉各大门户网站及行业网站；', '4、对网络营销有深刻理解，熟悉各种行销方式：竞价排名、网络广告投放、电子邮件营销、bbs营销、web2.0营销等。', '福利待遇', '1、福利=高底薪+高提成+人性化管理+宽广的发展空间+节礼+绩效奖励等；', '2、享有国家法定节假日，年度旅游，季度活动，节日福利；', '3、入司满一年享有年假； ', '4、年底双薪+年终奖； ', '5、五险一金；', '6、6天制，工作地点：宝安区西乡', '\r\n                ', '\r\n                                        ', '职能类别：', '网络/在线销售', '销售代表', '\r\n                                        ', '关键字：', '电商业务员', '\r\n                    ', '\r\n        ', '微信分享', '\r\n        ', '\r\n        ', '\r\n    ']"
https://jobs.51job.com/shenzhen-gmxq/118987019.html?s=01&t=0,电子商务专员 销售助理 (职位编号：2019120301),深圳市华馨京科技有限公司,0.6-1万/月,深圳-光明新区,1年经验,本科,合资,少于50人,原材料和加工,公明镇马山头第六工业区五栋二楼,"['\r\n        ', '1.负责公司线上销售平台的建设与架构。', '2.负责公司销售平台的销售与推广，', '解答客户咨询，处理订单及线上客户投诉，提高成交率和客户满意度。', '3.熟悉数据分析，能够据此进行类目、竞品及自己店铺的调研分析并制定相应营销方案。', '4.定时跟踪行内标杆企业和竞争对手的销售情况。', '5.收集整理客户的需求及反馈，协助工程优化产品。', '6.完成领导指派的其他工作任务。', '任职要求：', '1.电子商务专业，能适应电商运营高强度的工作及快速发展带来的各种变化；', '2.会进行图片的处理及美化；', '3.思维灵活且有逻辑性，敏锐的市场分析能力，善于解决各种业务问题。', '\r\n                ', '\r\n                                        ', '职能类别：', '电子商务专员', '网络/在线销售', '\r\n                                        ', '关键字：', '电子商务', '网络销售', '网站运营', '\r\n                    ', '\r\n        ', '微信分享', '\r\n        ', '\r\n        ', '\r\n    ']"
https://jobs.51job.com/shenzhen-ytq/118672938.html?s=01&t=0,电子商务部主管（快消行业）,深圳中萃企业管理有限公司,1-1.5万/月,深圳-盐田区,3-4年经验,大专,民营公司,150-500人,房地产,深圳盐田大梅沙金沙街3号梅沙国际公馆,"['\r\n        ', '1、根据公司整体的战略目标和发展规划，负责电子商务平台项目的整体规划、市场调研、运营规划，并制定相应的战术和工作目标；', '2、部门建设：负责部门的规划、人员配置和团队组建及日常管理制度、流程和规范的制定，并进行具体实施和监管；', '3、内外部合作资源建设：进行内外部合作资源的调研、合作谈判及合作管理等规划和实施具体工作；', '4、电商平台的推广：按照公司战略目标，制定电商平台推广方案、具体实施计划，并对实施工作进行操作及管理，快速达成战略目标及平台访问量及成交量的工作目标；', '5、相关线下活动工作：结合线上活动，与公司其他部门合作进行线下推广活动的策划、组织和实施，加强电商平台的快速推广及相应的绩效达成；', '6、费用管理：对部门费用进行预算、支付管理和相关决算，降低费用支出；', '7、领导交办的其他工作。', '\r\n                ', '\r\n                                        ', '职能类别：', '网店/淘宝运营', '商务主管/专员', '\r\n                                ', '\r\n        ', '微信分享', '\r\n        ', '\r\n        ', '\r\n    ']"
https://jobs.51job.com/shenzhen-lgq/82881565.html?s=01&t=0,酒店OP/客服/酒店预订员/电子商务,深圳市众信旅旅游服务有限公司,0.8-1万/月,深圳-龙岗区,无工作经验,中专,民营公司,少于50人,酒店/旅游,广东省深圳市龙岗区大运中心如意路52号荣超金融大厦801室,"['\r\n        ', '岗位职责：酒店预订服务', '任职资格：应届生亦可', '职位描述：', '1、公司有稳定的客户群体，无需自行寻找客户，根据客户来电需求预定适合的酒店旅游产品及利用公司资源平台进行港澳酒店产品的销售预订；', '2、提供热情、周到、高效的酒店预订及其它旅游服务；', '3、拥有较好的沟通和协调能力，能快速回答客户的相关问题；', '岗位要求：', '1、男女不限，中专或大专以上学历，应届生亦可；', '2、打字60/分钟以上，熟练操作office办公软件及网络操作。', '3、性格热情、开朗、积极向上，要有较好的耐心，有团队协作精神，能吃苦耐劳，身体健康；', '4、有酒店销售或客服工作经验者优先。', '5、公司良好的工作环境，有意者请在线申请职位或致电18665836487邱小姐', '薪资：', '公司采用底薪+提成制（提成比例为阶梯式)+社保+交通补贴+绩效奖+年终奖+出国旅游+下午茶', '\r\n                ', '\r\n                                        ', '职能类别：', '旅游产品销售', '预定员', '\r\n                                        ', '关键字：', '客服', '酒店预订员', '文员', '旅游顾问', '电子商务', '网络营销', '\r\n                    ', '\r\n        ', '微信分享', '\r\n        ', '\r\n        ', '\r\n    ']"
https://jobs.51job.com/shenzhen/111547517.html?s=01&t=0,电子商务主管/经理（网店运营）,广东中成实业控股（集团）有限公司,0.7-1.2万/月,深圳,3-4年经验,大专,民营公司,500-1000人,多元化业务集团公司,深圳宝安区燕罗街道松岗社区第二工业区中成科技园,"['\r\n        ', '（一）岗位职责：', '1、全权负责线上店铺（京东或京微、阿里巴巴等）的运营；', '2、负责店铺各类促销活动策划、实施，跟踪活动结果，并对其效果进行评估；', '3、负责运营推广费用提报、使用、管控等；', '4、负责店铺数据汇总和统计，分析店铺运营数据，并制作总结报告，供领导决策参考；', '5、对网店售前、售中及售后客服工作进行跟踪管理；', '6、按时完成店铺收入对账与结算；', '7、疑难客户投诉与退款处理。', '（二）任职资格：', '1、有电商运营工作（含京东、淘宝、天猫、京微平台、阿里巴巴）经验者3年以上，熟悉食品、母婴类目优先；', '2、对熟悉店铺后台运营，有较强的市场感知能力，敏锐把握市场动态方向；', '3、熟悉网店各种宣传推广；', '4、有较好的人际沟通、组织协调、执行和应变能力，具有强烈的责任心；', '5、具备较好的团队管理能力，愿意培养团队成员。', '（三）工作相关信息及福利待遇：（更多细节面谈环节交流）', '1、入职即购买五险；', '2、营销类岗位薪资结构：具有竞争力底薪（无责任）+丰厚的提成+年终分红', '3、员工享有带薪婚假、年假、产假、病假、丧假、工伤假等各类带薪假；', '4、准时发放薪资，年终享有年终奖，提成每月月初发放；', '5、生日礼品、节假日礼品，年度旅游，各种聚餐、团队活动、带薪年假、提供住宿；', '\r\n                ', '\r\n                                        ', '职能类别：', '电子商务经理/主管', '网店/淘宝店长', '\r\n                                ', '\r\n        ', '微信分享', '\r\n        ', '\r\n        ', '\r\n    ']"
https://jobs.51job.com/shenzhen-lhxq/118726831.html?s=01&t=0,电子商务美工,深圳市易麦乐科技有限公司,0.5-1万/月,深圳-龙华新区,1年经验,中专,民营公司,少于50人,贸易/进出口,大浪街道陶吓永创科技园C栋4楼,"['\r\n        ', '岗位职责：', '1. 负责产品拍摄、修图、主图排版设计、产品详情页设计等；', '2. 负责组织协调与任务需求人、摄影师等沟通讨论设计提案，并完成最终设计效果；', '3. 完成领导交代的其他平面设计工作；', '任职要求：', '1、一年以上设计经验，平面设计或美术、广告设计相关专业。', '2、做过天猫详情图的优先；', '3、有较强对精修产品图、视觉效果、文字特效、排版等有较强的把握能力；', '4、有较强,画面构图能力，能独立完成产品展示排版、产品卖点提取、产品详情介绍页面及广告活动设计等；', '5、熟练使用单反相机者优先考虑', '6、适应能力强，能在短期内融入团队，具有团队精神和一定的抗压能力。', '福利待遇：', '1、 公司提供优雅的办公环境，员工相处融洽，互相帮助，公司氛围积极向上，正能量足。', '2、 完善的晋升机制，为员工的提升和晋级提供充足的通道。', '3、 具有完善的培训机制，针对性的岗位培训，包括新员工一对一的辅导培训，老员工的定期提升培训等；', '4、 极富竞争力的待遇，高于同行的提成标准，平均工资在行业内大幅领先。', '5、 享受社保：养老、医疗、失业、生育、工伤，5险齐全。', '6、 享受国家法定节假日及节日福利，满一年工作年限同时享有5天的带薪年休假；', '7、 公司不定期开展活动、每年1-2次省内或者省外或出国游。', '8、 每月定期为员工举行生日派对', '9、 每日下午15分钟的下午茶歇时间', '10、 公司附件交通便利，生活方便，租费成本低，附近治安非常好。', '11、 工作时间：大小周（大周2天休假，小周1天休假），8：30-12：00 ，13：30－18:00，午休1.5小时', '交通情况', '工作地址：深圳市龙华新区陶吓村 永创科技园 C栋401室', '地铁：龙胜地铁站B出口（再步行15分钟）', '公交站台：', '陶吓路口：B830；（公司楼下）', '元芬村站：612路;B830路;m420路（下车后2分钟）', '赤岭头站：612路;B830路;m193路;m214路;m301路;m341路;m415路;m420路;m462路;高峰专线15路;高峰专线38路;旅游7线, 在本站下车后沿布龙路往北走，到龙华路左拐尽头左手边即到。（下车后5-8分钟）', '\r\n                ', '\r\n                                        ', '职能类别：', '平面设计师', '网店美工', '\r\n                                        ', '关键字：', '包装设计', '电商美工', '广告设计', '海报设计', '摄影', '展板设计', '\r\n                    ', '\r\n        ', '微信分享', '\r\n        ', '\r\n        ', '\r\n    ']"
https://jobs.51job.com/shenzhen-lhxq/109365661.html?s=01&t=0,电子商务实习生,深圳市菁创电子有限公司,4.5-6千/月,深圳-龙华新区,无工作经验,本科,民营公司,500-1000人,互联网/电子商务,民治大大道展滔科技大厦C座1411室,"['\r\n        ', '职位体系： 扁平化管理+强悍的学习氛围+公平合理的晋升机制', '特别提示：入职前会有专业的岗前培训，入职后每周会有1-2次客服、运营知识培训', '发展空间：明确的晋升路线+完善的培训体系+成长导师悉心辅导；管理路线+专业路线双通道发展！', '         管理通道：基层--中层--高层--合伙人', '         专业通道：初级--高级--资深--专家--合伙人', '岗位职责：', '1、通过在线接待客户，及时、有效、妥善的处理客户的询单问题，促成订单成交；', '2、负责发展维护良好的客户关系，刺激二次购买；', '3、收集并整理客户反馈的信息，了解并分析客户需求，规划客户服务方案。', '（本岗位作为运营储备，通过考核可以晋升）', '岗位要求：', '1、热爱电子商务行业，勤奋好学；', '2、打字速度在50字/分钟以上，能接受早晚班制', '3、性格开朗、外向，具备良好的沟通能力和团队合作能力；', '4、能吃苦耐劳，有强烈的进取心；', '加入蓝禾，我们将为您提供：', '1、薪酬体系：最富竞争力的薪酬激励体系(底薪+奖金+贡献奖+半年度分红)', '2、五险一金：养老保险，医疗保险，失业保险，工伤保险，生育保险，住房公积金；', '3、带薪休假：10天带薪春节假+4-6天带薪旅游假+带薪法定假日', '4、文娱生活：半年度旅游+部门团建+员工图书馆+悠闲下午茶+免费运动场', '\r\n                ', '\r\n                                        ', '职能类别：', '电子商务专员', '\r\n                                ', '\r\n        ', '微信分享', '\r\n        ', '\r\n        ', '\r\n    ']"
